NAME,Site_Name,distance_to_site_miles,ZIP,STATE,CITY,CNTY,LAT,LON
LONGFELLOW ELEMENTARY,Fruit Avenue Plume,0.04573758284697423,87102,NM,ALBUQUERQUE,35001,35.08606,-106.641272
Insight School of WA Open Doors Program,"Commencement Bay, South Tacoma Channel",0.05080917625617846,98409,WA,Tacoma,53053,47.2287,-122.471361
Basin School,Basin Mining Area,0.059318622512047364,59631,MT,Basin,30043,46.272891,-112.264558
Van Cleve Elementary School,East Troy Contaminated Aquifer,0.06630252679627542,45373,OH,Troy,39109,40.037287,-84.196757
North Belmont Elementary,North Belmont PCE,0.06818298877802474,28012,NC,Belmont,37071,35.2727,-81.0505
INES MARIA MENDOZA DE MUNOZ MARIN CABO ROJO,Cabo Rojo Ground Water Contamination,0.06967924756949663,623,PR,CABO ROJO,72023,18.090111,-67.147497
Ravenswood High School,Ravenswood PCE Ground Water Plume,0.07312822885411048,26164,WV,Ravenswood,54035,38.952091,-81.760413
Cove Day School,Lukachukai Mountains Mining District,0.07857227972065432,86544,AZ,Red Valley,4001,36.558631,-109.219096
TAGOS Leadership Acad,Janesville Ash Beds,0.09198369577777679,53545,WI,Janesville,55105,42.702183,-89.028861
Paden City High School,Paden City Groundwater,0.09531028079085804,26159,WV,Paden City,54103,39.605674,-80.931943
Freeman High School,Grain Handling Facility at Freeman,0.09975619797081882,99030,WA,Rockford,53063,47.5197,-117.1964
North Ward Elementary School,Rockwell International Corp. (Allegan Plant),0.10173565965621487,49010,MI,ALLEGAN,26005,42.5362,-85.8481
West Chicago Comm High School,Kerr-McGee (Residential Areas),0.10408155708233312,60185,IL,West Chicago,17043,41.87936,-88.206021
ABQ CHARTER ACADEMY,Fruit Avenue Plume,0.10798048462911251,87102,NM,ALBUQUERQUE,35001,35.086232,-106.642515
Thomas Jefferson School #9,"Curcio Scrap Metal, Inc.",0.11245495696993343,7026,NJ,Garfield,34003,40.889743,-74.105245
Ravenswood Middle School,Ravenswood PCE Ground Water Plume,0.11788102990865858,26164,WV,Ravenswood,54035,38.952393,-81.759671
JUDITH A. VIVAS,"Papelera Puertorriquena, Inc.",0.11933490086512191,641,PR,UTUADO,72141,18.266863,-66.695568
Freeman Middle School,Grain Handling Facility at Freeman,0.12556927666759984,99030,WA,Rockford,53063,47.5177,-117.1944
Freeman Elementary School,Grain Handling Facility at Freeman,0.12556927666759984,99030,WA,Rockford,53063,47.5177,-117.1944
LOLA RODRIGUEZ DE TIO,San German Ground Water Contamination,0.12862301591785813,683,PR,SAN GERMAN,72125,18.082586,-67.035763
SCHOOL AGED PARENTING PROGRAM,Bandera Road Ground Water Plume,0.1324634762572362,78238,TX,SAN ANTONIO,48029,29.493921,-98.618381
HOMEBOUND,Bandera Road Ground Water Plume,0.1324634762572362,78238,TX,SAN ANTONIO,48029,29.493921,-98.618381
Jacques Memorial Elementary School,Fletcher's Paint Works & Storage,0.13467201207692917,3055,NH,Milford,33011,42.836264,-71.652811
WOODMERE MIDDLE SCHOOL,Peninsula Boulevard Ground Water Plume,0.136149460675871,11557,NY,HEWLETT,36059,40.6431,-73.709
Wallace Stegner Academy,Portland Cement (Kiln Dust 2 & 3),0.13706602029425227,84104,UT,SALT LAKE CITY,49035,40.747888,-111.946152
HILLSBOROUGH GIRLS ACADEMY,Peak Oil Co./Bay Drum Co.,0.1394580179865982,33619,FL,TAMPA,12057,27.968796,-82.34078
Butler High School,Peach Orchard Road PCE Ground Water Plume,0.1396708654938087,30906,GA,Augusta,13245,33.419534,-82.016543
JAMES FANNIN MIDDLE,Delfasco Forge,0.14117404360192726,75050,TX,GRAND PRAIRIE,48113,32.751947,-96.96461
Cleveland Street Elementary School,Orange Valley Regional Ground Water Contamination,0.1446728728504231,7050,NJ,ORANGE,34013,40.782,-74.2256
Muskegon Montessori Academy for Environmental Change,Kaydon Corp.,0.14758391996040185,49441,MI,NORTON SHORES,26121,43.199061,-86.292672
MONTGOMERY CO J J A E P,United Creosoting Co.,0.15494396091289023,77301,TX,CONROE,48339,30.333746,-95.455682
PROJECT RESTORE,United Creosoting Co.,0.15494396091289023,77301,TX,CONROE,48339,30.333746,-95.455682
Delair Elementary School,Puchack Well Field,0.1562560596155824,8110,NJ,DELAIR,34007,39.9753,-75.0543
Chamberlain Elementary School,North 5th Street Groundwater Contamination,0.15673706484084277,46528,IN,Goshen,18039,41.5925,-85.8326
Cleveland Street Elementary School,U.S. Radium Corp.,0.16227093481088412,7050,NJ,ORANGE,34013,40.782,-74.2256
AURORA CHARTER SCHOOL,South Minneapolis Residential Soil Contamination,0.16254235997016725,55404,MN,MINNEAPOLIS,27053,44.95484,-93.241051
AURORA MIDDLE SCHOOL,South Minneapolis Residential Soil Contamination,0.16254235997016725,55404,MN,MINNEAPOLIS,27053,44.95484,-93.241051
STEWART SCHOOL,Old Roosevelt Field Contaminated Ground Water Area,0.17557708241978812,11530,NY,GARDEN CITY,36059,40.7311,-73.6188
BELLEVUE MISSION MIDDLE SCHOOL,PCE - Carriage Cleaners,0.17580701037120267,68005,NE,BELLEVUE,31153,41.137185,-95.897402
Bob Holcomb Elementary,Newmark Ground Water Contamination,0.17755549703380805,92407,CA,San Bernardino,6071,34.1715,-117.3162
Atwater Avenue Elementary,San Fernando Valley (Area 4),0.18064649186528967,90039,CA,Los Angeles,6037,34.114677,-118.254097
Great River Elementary School,Koppers Coke,0.18295463105170096,55108,MN,SAINT PAUL,27123,44.970377,-93.155464
GREAT RIVER SCHOOL,Koppers Coke,0.18295463105170096,55108,MN,SAINT PAUL,27123,44.970377,-93.155464
RANDALL MIDDLE SCHOOL,Rosen Brothers Scrap Yard/Dump,0.1850947148714639,13045,NY,CORTLAND,36023,42.5943,-76.1747
LINDSAY ATTENDANCE CENTER,Lindsay Manufacturing Co.,0.1857195760026175,68644,NE,LINDSAY,31141,41.702527,-97.693426
Gibbsboro Elementary School,Sherwin-Williams/Hilliards Creek,0.18787039381289272,8026,NJ,GIBBSBORO,34007,39.837241,-74.967729
NEW DAWN CHARTER HIGH SCHOOL,Gowanus Canal,0.18873616788637845,11217,NY,BROOKLYN,36047,40.683036,-73.990439
Trinity School,Kerr-McGee (Residential Areas),0.18976575746954366,60185,IL,West Chicago,17043,41.879407,-88.210907
JJAEP,United Creosoting Co.,0.19379095409167174,77301,TX,CONROE,48339,30.33412,-95.455083
Lynnewood El Sch,Havertown PCP,0.19480431503492046,19083,PA,Havertown,42045,39.982692,-75.322313
Elwood Haynes Elementary School,Kokomo Contaminated Ground Water Plume,0.1952543463685767,46901,IN,Kokomo,18067,40.4777,-86.1112
LOGAN-ROGERSVILLE PRIMARY,Compass Plaza Well TCE,0.20362225626992542,65742,MO,ROGERSVILLE,29077,37.109788,-93.07958
Roosevelt School #7,Garfield Ground Water Contamination,0.20438176647128628,7026,NJ,GARFIELD,34003,40.873683,-74.103348
West Essex High School,Caldwell Trucking Co.,0.20439892834250223,7006,NJ,NORTH CALDWELL,34013,40.873815,-74.269493
LANDING SCHOOL,"Mattiace Petrochemical Co., Inc.",0.2066060685744312,11542,NY,GLEN COVE,36059,40.863433,-73.645038
Woodcrest Elementary,Orange County North Basin,0.20758757657744026,92832,CA,Fullerton,6059,33.8577,-117.9316
Iola Elementary School,Former United Zinc & Associated Smelters,0.21165464337047757,66749,KS,Iola,20001,37.924433,-95.388661
HIGHLANDS ELEMENTARY SCHOOL,General Dynamics Longwood,0.21463577318744725,32708,FL,WINTER SPRINGS,12117,28.716543,-81.317692
Joseph Gomez Elementary School,Tutu Wellfield,0.21588181824186223,802,VI,Saint Thomas,78030,18.342789,-64.887972
CORTLAND JUNIOR HIGH SCHOOL,Rosen Brothers Scrap Yard/Dump,0.21939327566660333,13045,NY,CORTLAND,36023,42.588555,-76.174555
CORTLAND HIGH SCHOOL,Rosen Brothers Scrap Yard/Dump,0.21939327566660333,13045,NY,CORTLAND,36023,42.588555,-76.174555
Orange Early Childhood Center,U.S. Radium Corp.,0.21987859627686004,7050,NJ,Orange,34013,40.7783,-74.2295
Southwest Tech,"Jard Company, Inc.",0.22088695015259333,5201,VT,Bennington,50003,42.886582,-73.192165
Catawba Heights Elementary,Jadco-Hughes Facility,0.22253400865890174,28012,NC,Belmont,37071,35.2745,-81.0375
Lincoln Memorial Elem,Caney Residential Yards,0.22334765271107812,67333,KS,Caney,20125,37.0154,-95.932
Blades Elementary School,Blades Groundwater,0.2253543818912723,19973,DE,Blades,10005,38.630991,-75.606348
Bountiful School,Five Points PCE Plume,0.22780687810777775,84010,UT,BOUNTIFUL,49011,40.873535,-111.882873
Roberto Clemente International Dual Language School,Scovill Industrial Landfill,0.22852509248306072,6705,CT,Waterbury,9140,41.547133,-73.010039
Kiser Elementary School,Behr Dayton Thermal System VOC Plume,0.23032894268574672,45404,OH,Dayton,39113,39.7834,-84.1753
Beverly City School District,Cosden Chemical Coatings Corp.,0.2356563416577301,8010,NJ,BEVERLY,34005,40.0607,-74.9229
PS 32 SAMUEL MILLS SPROLE,Gowanus Canal,0.23619204791752108,11231,NY,BROOKLYN,36047,40.6803,-73.9915
Mt. Anthony Senior Union High School,"Jard Company, Inc.",0.23679852688373235,5201,VT,Bennington,50003,42.885808,-73.191203
WASHINGTON AVE ELEMENTARY,Lea and West Second Street,0.238800374620943,88201,NM,ROSWELL,35005,33.397033,-104.532085
GEORGE PEABODY EL,RSR Corp.,0.2404402704741197,75212,TX,DALLAS,48113,32.777978,-96.868534
FRANKLIN EARLY CHILDHOOD CENTER,Peninsula Boulevard Ground Water Plume,0.24529989695998164,11557,NY,HEWLETT,36059,40.6393,-73.7069
Walpole High,Blackburn and Union Privileges,0.2458116605512315,2081,MA,Walpole,25021,42.136641,-71.247798
NORPHLET MIDDLE SCHOOL,MacMillan Ring Free Oil,0.24724946156061495,71759,AR,NORPHLET,5139,33.310348,-92.66045
Orange Early Childhood Center,Orange Valley Regional Ground Water Contamination,0.24785941054426708,7050,NJ,Orange,34013,40.7783,-74.2295
LAKE ACADEMY SECURE,Peak Oil Co./Bay Drum Co.,0.2499251395960695,33619,FL,TAMPA,12057,27.967552,-82.342244
LAKE ACADEMY,Peak Oil Co./Bay Drum Co.,0.2499251395960695,33619,FL,TAMPA,12057,27.967552,-82.342244
Westmoreland Elementary School,Fair Lawn Well Field,0.2511570852035607,7410,NJ,FAIR LAWN,34003,40.9408,-74.1339
Keystone El Sch,Croydon TCE,0.2515448151139013,19021,PA,Croydon,42017,40.08606,-74.893751
Forest Elementary School,East Troy Contaminated Aquifer,0.25202217889503703,45373,OH,Troy,39109,40.035946,-84.199954
Community Middle School,Brook Industrial Park,0.2530474483087639,8805,NJ,Bound Brook,34035,40.562634,-74.532583
Windemere Park Charter Academy,Adam's Plating,0.25335147080668524,48917,MI,LANSING,26065,42.7418,-84.5916
Great Valley MS,Malvern TCE,0.25464308405915514,19355,PA,Malvern,42029,40.0591,-75.5646
PS/IS 384 FRANCES E CARTER,Wolff-Alport Chemical Company,0.2561924982402792,11207,NY,BROOKLYN,36047,40.6897,-73.9049
THENA CROWDER EARLY CHILDHOOD DIAGNOSTIC SPECIAL EDUCATION,Continental Cleaners,0.2563962590458752,33150,FL,MIAMI,12086,25.835594,-80.209906
Clark Elementary School,Highway 3 PCE,0.2570606371466467,51031,IA,Le Mars,19149,42.795814,-96.169848
JESUS T. PINERO CIDRA,Cidra Ground Water Contamination,0.25747663641635454,739,PR,CIDRA,72041,18.173925,-66.15841
Jefferson Elementary,"N.W. Mauthe Co., Inc.",0.2578255133069876,54914,WI,Appleton,55087,44.2541,-88.4252
Stebbins High School,Valley Pike VOCs,0.258053280582182,45424,OH,Dayton,39113,39.7965,-84.1277
John A. Forrest Elementary School,Fair Lawn Well Field,0.259162603090238,7410,NJ,FAIR LAWN,34003,40.9341,-74.1299
HILLSBOROUGH GIRLS ACADEMY,Reeves Southeastern Galvanizing Corp.,0.26389465430239023,33619,FL,TAMPA,12057,27.968796,-82.34078
Donnelsville Elementary School,Donnelsville Contaminated Aquifer,0.26460893941363095,45319,OH,Donnelsville,39023,39.9195,-83.9439
METRO DEAF SCHOOL,Koppers Coke,0.265684276039798,55108,MN,SAINT PAUL,27123,44.972283,-93.147354
LUIS MUNOZ IGLESIAS,Cidra Ground Water Contamination,0.2668314859759898,739,PR,CIDRA,72041,18.178647,-66.1598
Utah Connections Academy,Wasatch Chemical Co. (Lot 6),0.26695847486884,84106,UT,SALT LAKE CITY,49035,40.726113,-111.87264
OMAHA HIGH SCHOOL,"Arkwood, Inc.",0.26707040832008433,72662,AR,OMAHA,5009,36.448833,-93.196179
OMAHA ELEMENTARY SCHOOL,"Arkwood, Inc.",0.26707040832008433,72662,AR,OMAHA,5009,36.448833,-93.196179
Mad River Middle School,Valley Pike VOCs,0.2679961739982652,45424,OH,Dayton,39113,39.793644,-84.130627
TAGOS Leadership Acad,Janesville Old Landfill,0.26889840444767643,53545,WI,Janesville,55105,42.702183,-89.028861
PEDRO NELSON COLBERG,Cabo Rojo Ground Water Contamination,0.2702163058221206,623,PR,CABO ROJO,72023,18.087107,-67.150159
Lincoln International High School,South Minneapolis Residential Soil Contamination,0.27072084656064804,55404,MN,MINNEAPOLIS,27053,44.956362,-93.240406
Sartori Elementary School,Pacific Car & Foundry Co.,0.27310151836849683,98057,WA,Renton,53033,47.487417,-122.201784
Neale Elementary School,Vienna Tetrachloroethene,0.273740462308717,26105,WV,Vienna,54107,39.32232,-81.552334
York Avenue El Sch,North Penn - Area 6,0.27378223318263833,19446,PA,Lansdale,42091,40.2444,-75.2958
CENTRAL ELEMENTARY SCHOOL,PCE - Carriage Cleaners,0.27393574097083523,68005,NE,BELLEVUE,31153,41.137917,-95.899369
Henry P. Becton Regional High School,Universal Oil Products (Chemical Division),0.27425191426810847,7073,NJ,EAST RUTHERFORD,34003,40.832209,-74.093259
TAMPA RESIDENTIAL FACILITY,Peak Oil Co./Bay Drum Co.,0.27463223153847244,33619,FL,TAMPA,12057,27.96682,-82.340877
GRANTS HIGH,Grants Chlorinated Solvents Plume,0.2759115920484088,87020,NM,GRANTS,35006,35.15914,-107.8465
N B Mills Elementary,"FCX, Inc. (Statesville Plant)",0.27918567385081106,28677,NC,Statesville,37097,35.7879,-80.9116
VIENNA ELEM.,Vienna Wells,0.2793063200087872,65582,MO,VIENNA,29125,38.18571,-91.942883
VIENNA MIDDLE,Vienna Wells,0.2793063200087872,65582,MO,VIENNA,29125,38.18571,-91.942883
VIENNA HIGH,Vienna Wells,0.2793063200087872,65582,MO,VIENNA,29125,38.18571,-91.942883
Park Avenue Elementary School,Orange Valley Regional Ground Water Contamination,0.27947000274136435,7050,NJ,ORANGE,34013,40.776,-74.2242
WILFREDO LAFUENTE ORTIZ,Maunabo Area Ground Water Contamination,0.2814348136324825,707,PR,MAUNABO,72095,18.009804,-65.90212
Henry (Patrick) Elementary,Orange County North Basin,0.2817438395478437,92801,CA,Anaheim,6059,33.8512,-117.9328
LANDING SCHOOL,Li Tungsten Corp.,0.28187408124254704,11542,NY,GLEN COVE,36059,40.863433,-73.645038
H. S. Chase School,Scovill Industrial Landfill,0.2833096027820082,6705,CT,Waterbury,9140,41.5528,-73.0062
Sierra Vista Elementary,"Brown & Bryant, Inc. (Arvin Plant)",0.2834816035966216,93203,CA,Arvin,6029,35.202579,-118.827018
Souderton CS Collaborative,North Penn - Area 1,0.28735125398665584,18964,PA,Souderton,42091,40.309652,-75.319928
John D. Bud Hawk Elementary at Jackson Park,Jackson Park Housing Complex (USNAVY),0.28794655114893564,98312,WA,BREMERTON,53035,47.5928,-122.6963
Fox River Academy,"N.W. Mauthe Co., Inc.",0.28889526096805457,54914,WI,Appleton,55087,44.254529,-88.424338
MTS HIGH SCHOOL,South Minneapolis Residential Soil Contamination,0.2899453604525506,55406,MN,MINNEAPOLIS,27053,44.950685,-93.237587
COLUMBUS RESIDENTIAL JUVENILE FACILITY,Peak Oil Co./Bay Drum Co.,0.2904324414798126,33619,FL,TAMPA,12057,27.966786,-82.341903
MESA VIEW ELEMENTARY,Grants Chlorinated Solvents Plume,0.29047463859337275,87020,NM,GRANTS,35006,35.152388,-107.840865
Minnesota Connections Academy 7-12,Koppers Coke,0.2919699046668678,55108,MN,SAINT PAUL,27123,44.969301,-93.157092
Minnesota Connections Academy K-6,Koppers Coke,0.2919699046668678,55108,MN,SAINT PAUL,27123,44.969301,-93.157092
ANTHONY ALFANO ELEMENTARY SCHOOL,"MacKenzie Chemical Works, Inc.",0.2931843597518233,11722,NY,CENTRAL ISLIP,36103,40.7931,-73.2051
COBBLE HILL SCHOOL OF AMERICAN STUDIES,Gowanus Canal,0.293287962053834,11201,NY,BROOKLYN,36047,40.6849,-73.9909
Broadwater School,Billings PCE,0.29335679574733076,59102,MT,Billings,30111,45.777532,-108.52654
ISABEL FLORES,Juncos Landfill,0.2940292877161041,777,PR,JUNCOS,72077,18.227567,-65.909486
Gibbsboro Elementary School,United States Avenue Burn,0.2945671527422986,8026,NJ,GIBBSBORO,34007,39.837241,-74.967729
MCCULLOCH ELEMENTARY,"Solid State Circuits, Inc.",0.29499153364464414,65738,MO,REPUBLIC,29077,37.121801,-93.477747
ALFONSO CASTA MARTINEZ,Maunabo Area Ground Water Contamination,0.2958427120348343,707,PR,MAUNABO,72095,18.00709,-65.897337
NORCREST ELEMENTARY SCHOOL,Flash Cleaners,0.2959290849384689,33064,FL,POMPANO BEACH,12011,26.28031,-80.101043
HERMOSA HEIGHTS ELEMENTARY,Griggs & Walnut Ground Water Plume,0.2963966762388695,88001,NM,LAS CRUCES,35013,32.311508,-106.76165
Pontiac Elementary,Townsend Saw Chain Co.,0.2964106619917584,29045,SC,Elgin,45079,34.109643,-80.837329
Excel Academy Rhode Island,Centredale Manor Restoration Project,0.2975208824782249,2911,RI,North Providence,44007,41.854982,-71.482727
Lafayette Elementary School,Brook Industrial Park,0.2984926239280018,8805,NJ,Bound Brook,34035,40.564403,-74.536724
Abraham Lincoln School #6,Garfield Ground Water Contamination,0.2992264710770852,7026,NJ,GARFIELD,34003,40.8677,-74.1079
ANA J. CANDELAS,Cidra Ground Water Contamination,0.299726467116689,739,PR,CIDRA,72041,18.170758,-66.162232
Fairview Elementary School,Cliff Drive Groundwater Contamination,0.30129941660762793,46947,IN,Logansport,18017,40.74,-86.3764
Wenzel School,Sturgis Municipal Wells,0.30175414067788514,49091,MI,STURGIS,26149,41.7945,-85.4264
Friendship PCS - Chamberlain Elementary,Washington Navy Yard,0.3044967360834271,20003,DC,Washington,11001,38.87933,-76.986711
Friendship PCS - Chamberlain Middle,Washington Navy Yard,0.3044967360834271,20003,DC,Washington,11001,38.87933,-76.986711
Washington High School,Sporlan Valve Plant #1,0.30534633694176266,63090,MO,Washington,29071,38.547964,-91.009187
HENRY W. LONGFELLOW,San German Ground Water Contamination,0.30560476585811586,683,PR,SAN GERMAN,72125,18.080283,-67.03719
WEST SIDE ELEMENTARY SCHOOL,Picayune Wood Treating,0.3062189858766616,39466,MS,Picayune,28109,30.528861,-89.690195
SALTZMAN EAST MEMORIAL ELEMENTARY SCHOOL,Preferred Plating Corp.,0.30775673847907575,11735,NY,FARMINGDALE,36103,40.7176,-73.4307
Tweedy Elementary,Cooper Drum Company,0.3091159799529354,90280,CA,South Gate,6037,33.943093,-118.182354
CASS LAKE-BENA AREA LRNG. CNTR.,St. Regis Paper Co.,0.30965728913989876,56633,MN,CASS LAKE,27021,47.379926,-94.603905
Garfield Elementary School,Riverside Industrial Park,0.31085941916738274,7032,NJ,KEARNY,34017,40.7646,-74.1533
LANIER-JAMES EDUCATION CENTER,Petroleum Products Corp.,0.312975347083215,33009,FL,HALLANDALE BEACH,12011,25.992732,-80.164617
Patterson High,Kane & Lombard Street Drums,0.31389402254664184,21224,MD,Baltimore,24510,39.293649,-76.536571
ST. LOUIS PARK SPECIAL ED. PROGRAM,Highway 100 and County Road 3 Groundwater Plume,0.3161081023036545,55416,MN,SAINT LOUIS PARK,27053,44.93947,-93.359151
Crittenden Middle,Teledyne Semiconductor,0.31779702612109445,94043,CA,Mountain View,6085,37.411647,-122.085432
NASSAU CO JUVENILE DETENTION CENTER,New Cassel/Hicksville Ground Water Contamination,0.31870286851738233,11590,NY,WESTBURY,36059,40.754784,-73.554514
Alamo Elementary,Alamo Contaminated Ground Water,0.3190367745266074,38001,TN,Alamo,47033,35.7839,-89.1123
Meridian Impact Re-Engagement,Oeser Co,0.32184660280093397,98225,WA,Bellingham,53073,48.76569,-122.512861
Bonner School,Milltown Reservoir Sediments,0.32260821776916687,59823,MT,Bonner,30063,46.869339,-113.872267
Bonner 6-8,Milltown Reservoir Sediments,0.32260821776916687,59823,MT,Bonner,30063,46.869339,-113.872267
Casimer M. Dallago Jr. Impact Center,Former Kil-Tone Company,0.32308059719701404,8360,NJ,VINELAND,34011,39.482993,-75.02454
MINEOLA HIGH SCHOOL,Fulton Avenue,0.3245918219279396,11040,NY,GARDEN CITY PARK,36059,40.742,-73.6577
GRANT ELEMENTARY SCHOOL,Iowa-Nebraska Light & Power Co,0.3247622601390654,68701,NE,NORFOLK,31119,42.030432,-97.422854
HENRYETTA ES,Henryetta Iron and Metal,0.3252164360064017,74437,OK,Henryetta,40111,35.442643,-96.004597
Heliotrope Avenue Elementary,Pemaco Maywood,0.3256676668386792,90270,CA,Maywood,6037,33.985754,-118.17695
Gloria M Sabater Elementary School,Former Kil-Tone Company,0.3269566525160981,8360,NJ,VINELAND,34011,39.4831,-75.0252
PS 38 PACIFIC (THE),Gowanus Canal,0.3286600647575064,11217,NY,BROOKLYN,36047,40.685,-73.9829
JUVENILE JUSTICE ALTERNATIVE EDUCATION PROGRAM,United Creosoting Co.,0.33070536858220484,77301,TX,CONROE,48339,30.333977,-95.45181
JUVENILE DETENTION CTR,United Creosoting Co.,0.33070536858220484,77301,TX,CONROE,48339,30.333977,-95.45181
West Essex Middle School,Caldwell Trucking Co.,0.33112398644492314,7006,NJ,NORTH CALDWELL,34013,40.8741,-74.2658
PS 151 LYNDON B JOHNSON,Wolff-Alport Chemical Company,0.3321135941251572,11237,NY,BROOKLYN,36047,40.6934,-73.9083
Crooked Billet El Sch,Raymark,0.3337375154901231,19040,PA,Hatboro,42091,40.184479,-75.099367
ELEMENTAL URBANA DE VEGA ALTA,Vega Alta Public Supply Wells,0.3338500198790149,692,PR,VEGA ALTA,72143,18.413122,-66.329311
CORDELLO AVENUE ELEMENTARY SCHOOL,"MacKenzie Chemical Works, Inc.",0.3363751372881536,11722,NY,CENTRAL ISLIP,36103,40.7841,-73.2044
Old Mill Elementary School,"Waldick Aerospace Devices, Inc.",0.33649564670341037,8750,NJ,SEA GIRT,34025,40.1421,-74.055
Boston Renaissance Charter Public School,Lower Neponset River,0.33655403764596276,2136,MA,Hyde Park,25025,42.250753,-71.126542
San Miguel Elementary,"Advanced Micro Devices, Inc. (Building 915)",0.3366375462945282,94085,CA,Sunnyvale,6085,37.3914,-122.0085
NASSAU BOCES,Old Roosevelt Field Contaminated Ground Water Area,0.33701174311693755,11530,NY,GARDEN CITY,36059,40.728794,-73.619138
Abraham Lincoln,Silresim Chemical Corp.,0.3371450084579274,1851,MA,Lowell,25017,42.630319,-71.320249
TRANSITION PLUS SERVICES,South Minneapolis Residential Soil Contamination,0.33742547599553085,55407,MN,MINNEAPOLIS,27053,44.947926,-93.243024
ARMWOOD HIGH SCHOOL,Taylor Road Landfill,0.33819386501383103,33584,FL,SEFFNER,12057,28.005626,-82.296122
Juan Pablo Duarte - Jose Julian Marti School No 28,Chemical Control,0.33827969755911824,7206,NJ,ELIZABETH,34039,40.6463,-74.1885
Hamburg Area HS,Price Battery,0.33854293836884725,19526,PA,Hamburg,42011,40.551164,-75.974128
LAKE ACADEMY SECURE,Reeves Southeastern Galvanizing Corp.,0.3399991330381025,33619,FL,TAMPA,12057,27.967552,-82.342244
LAKE ACADEMY,Reeves Southeastern Galvanizing Corp.,0.3399991330381025,33619,FL,TAMPA,12057,27.967552,-82.342244
ESCAMBIA VIRTUAL ACADEMY FRANCHISE,Agrico Chemical Co.,0.34006151949439883,32503,FL,PENSACOLA,12033,30.447045,-87.222532
ESCAMBIA VIRTUAL INSTRUCTIONAL PROGRAM (DISTRICT PROVIDED),Agrico Chemical Co.,0.34006151949439883,32503,FL,PENSACOLA,12033,30.447045,-87.222532
TAP PK BABIES,Agrico Chemical Co.,0.34006151949439883,32503,FL,PENSACOLA,12033,30.447045,-87.222532
ESCAMBIA VIRTUAL INSTRUCTION PROGRAM,Agrico Chemical Co.,0.34006151949439883,32503,FL,PENSACOLA,12033,30.447045,-87.222532
ESCAMBIA SCH. DIST. JAIL PROG.,Agrico Chemical Co.,0.34006151949439883,32503,FL,PENSACOLA,12033,30.447045,-87.222532
COUNTY ADMINISTRATIVE ANNEX,Agrico Chemical Co.,0.34006151949439883,32503,FL,PENSACOLA,12033,30.447045,-87.222532
HOSPITAL & HOMEBOUND,Agrico Chemical Co.,0.34006151949439883,32503,FL,PENSACOLA,12033,30.447045,-87.222532
Slidell Junior High School,Bayou Bonfouca,0.3411731242644523,70458,LA,Slidell,22103,30.28013,-89.77898
MIAMI EDISON SENIOR HIGH SCHOOL,Continental Cleaners,0.3412652667795749,33127,FL,MIAMI,12086,25.831762,-80.204753
West Deptford High School,"Matteo & Sons, Inc.",0.3423183234225304,8093,NJ,WEST DEPTFORD,34015,39.855246,-75.161846
Cardinal O'Connell Early Learning Center,Silresim Chemical Corp.,0.34331599244997524,1852,MA,Lowell,25017,42.629842,-71.307239
PS 110 MONITOR (THE),Meeker Avenue Plume,0.34374241035200603,11222,NY,BROOKLYN,36047,40.7237,-73.9421
MURRAY MIDDLE SCHOOL,Solitron Microwave,0.34380817906158767,34997,FL,STUART,12085,27.134786,-80.194022
Haven Drive Middle,"Brown & Bryant, Inc. (Arvin Plant)",0.3454834062499185,93203,CA,Arvin,6029,35.205198,-118.82756
West Essex High School,Unimatic Manufacturing Corporation,0.3467660669314575,7006,NJ,NORTH CALDWELL,34013,40.873815,-74.269493
YES PREP - NORTHSIDE,North Cavalcade Street,0.34845084995431325,77026,TX,HOUSTON,48201,29.807559,-95.343455
James Madison School #10,Garfield Ground Water Contamination,0.34880411499180686,7026,NJ,GARFIELD,34003,40.867223,-74.103874
Career Pathways,Koppers Coke,0.3489610085613067,55104,MN,SAINT PAUL,27123,44.96834,-93.157341
International Studies Lrng Center at Legacy High Sch Complex,Southern Avenue Industrial Area,0.3492547074537339,90280,CA,South Gate,6037,33.941394,-118.178813
Sci Tech Engr Arts and Math at Legacy High Sch Complex,Southern Avenue Industrial Area,0.3492547074537339,90280,CA,South Gate,6037,33.941394,-118.178813
Visual and Performing Arts at Legacy High School Complex,Southern Avenue Industrial Area,0.3492547074537339,90280,CA,South Gate,6037,33.941394,-118.178813
Greystone School,Centredale Manor Restoration Project,0.35109099927120796,2911,RI,North Providence,44007,41.861687,-71.483101
SUPERIOR ILEANA DE GRACIA,Vega Alta Public Supply Wells,0.3512427016567083,692,PR,VEGA ALTA,72143,18.419664,-66.335194
Crittenden Middle,"CTS Printex, Inc.",0.35139732794994527,94043,CA,Mountain View,6085,37.411647,-122.085432
SCHOFIELD ELEMENTARY,"Solid State Circuits, Inc.",0.3525719687305832,65738,MO,REPUBLIC,29077,37.122475,-93.477122
Jackson El Sch,Whitmoyer Laboratories,0.35273556724118305,17067,PA,Myerstown,42075,40.3682,-76.3299
Woodstock Elementary School,Linemaster Switch Corp.,0.35316546364667134,6281,CT,Woodstock,9150,41.944576,-71.962709
SEVERO E. COLBERG RAMIREZ,Cabo Rojo Ground Water Contamination,0.3564948936743955,623,PR,CABO ROJO,72023,18.08708,-67.152165
Clay Hill Public Charter School,Kane & Lombard Street Drums,0.3564957454212893,21224,MD,Baltimore,24510,39.290969,-76.539039
Joseph B. Lancaster Elementary School,Madisonville Creosote Works,0.3565861073420533,70447,LA,Madisonville,22103,30.43231,-90.19965
San Cayetano Elementary,Pacific Coast Pipe Lines,0.3571199173976313,93016,CA,Fillmore,6111,34.4041,-118.9091
Northeast College Prep Charter Scho,Southeast Hennepin Area Groundwater and Vapor,0.3579381809723123,55413,MN,MINNEAPOLIS,27053,44.992287,-93.211573
Carter Lake Elementary School,American Lake Gardens/McChord AFB,0.3588631684217068,98439,WA,JBLM McChord Field,53053,47.128703,-122.521361
Lincoln Elementary School,Northernaire Plating,0.3608314611780488,49601,MI,CADILLAC,26165,44.2625,-85.4036
