NAME,Site_Name,distance_to_site_miles,ZIP,STATE,CITY,CNTY,LAT,LON
Sporting Hill El Sch,Navy Ships Parts Control Center,1.2365844624666085,17050,PA,Mechanicsburg,42041,40.2342,-76.9744
Emerald Ridge High School,Hidden Valley Landfill (Thun Field),1.237505498097689,98374,WA,Puyallup,53053,47.0896,-122.2629
Hawthorne Early Learning Center,Lusher Street Ground Water Contamination,1.238203309588593,46517,IN,Elkhart,18039,41.666336,-85.973826
Jenny Lind Elementary,Naval Industrial Reserve Ordnance Plant,1.2383281566889597,55430,MN,MINNEAPOLIS,27053,45.046782,-93.29241
San Miguel Elementary,National Semiconductor Corp.,1.2383848386328946,94085,CA,Sunnyvale,6085,37.3914,-122.0085
Earl Warren Elementary,Sacramento Army Depot,1.2390827867557102,95820,CA,Sacramento,6067,38.526172,-121.417587
Orange High School,Orange Valley Regional Ground Water Contamination,1.239245480753563,7050,NJ,ORANGE,34013,40.7656,-74.2394
Contemporary Learning Academy,Denver Radium Site,1.2397588475156311,80203,CO,DENVER,8031,39.73004,-104.984491
Martinsville High School,Pike and Mulberry Streets PCE Plume,1.2398476204239102,46151,IN,Martinsville,18109,39.4198,-86.4115
Oxnard Street Elementary,San Fernando Valley (Area 1),1.2402424587167888,91606,CA,North Hollywood,6037,34.179152,-118.368731
HIGH SCHOOL FOR RECORDING ARTS,Koppers Coke,1.2403849135656744,55104,MN,SAINT PAUL,27123,44.954404,-93.149827
PASADENA ELEMENTARY SCHOOL,Hooker Chemical & Plastics Corp./Ruco Polymer Corp.,1.2403900469764475,11803,NY,PLAINVIEW,36059,40.7726,-73.4915
BLUE MOUNTAIN MIDDLE SCHOOL,Magna Metals,1.2405452718112366,10567,NY,CORTLANDT MANOR,36119,41.2612,-73.8864
Garfield Middle School,Garfield Ground Water Contamination,1.2409363642005011,7026,NJ,GARFIELD,34003,40.886855,-74.11936
Althea Gibson Academy,U.S. Radium Corp.,1.2410511752028863,7017,NJ,EAST ORANGE,34013,40.7669,-74.2147
Altama Elementary School,Hercules 009 Landfill,1.2415225020892253,31525,GA,Brunswick,13127,31.222283,-81.480514
UTHOFF VALLEY ELEM.,Valley Park TCE,1.242126372322218,63026,MO,FENTON,29189,38.535027,-90.464472
BELTON NEW TECH H S AT WASKOW,Rockwool Industries Inc.,1.242411883046304,76513,TX,BELTON,48027,31.058101,-97.457678
BELTON NEW TECH H S AT WASKOW,Rockwool Industries Inc.,1.242411883046304,76513,TX,BELTON,48027,31.058101,-97.457678
Portola Springs Elementary,El Toro Marine Corps Air Station,1.2425147695330316,92618,CA,Irvine,6059,33.693825,-117.711404
PRESCHOOL LEARNING ACADEMY,PCE Southeast Contamination ,1.2429353618827137,68467,NE,YORK,31185,40.875584,-97.56995
YORK ELEMENTARY SCHOOL,PCE Southeast Contamination ,1.2429353618827137,68467,NE,YORK,31185,40.875584,-97.56995
Bowers Elementary,Intel Magnetics,1.243040040924319,95051,CA,Santa Clara,6085,37.3581,-121.9756
WYANDOTTE LEARNING CENTER,Parkview Well,1.2430452282742284,68801,NE,GRAND ISLAND,31079,40.898768,-98.341386
Sunny Hills High,McColl,1.2433585685856894,92833,CA,Fullerton,6059,33.883453,-117.954859
Gladiola Elementary School,Spartan Chemical Co.,1.243382100057948,49519,MI,WYOMING,26081,42.9015,-85.713
Peace Dale School,Rose Hill Regional Landfill,1.2434299809217062,2879,RI,Peace Dale,44009,41.45431,-71.500896
Edward T. Hamilton,United States Avenue Burn,1.2442267247937813,8043,NJ,VOORHEES,34007,39.826085,-74.942835
First Avenue School,Riverside Industrial Park,1.244550623349903,7107,NJ,NEWARK,34013,40.767512,-74.182888
RHODES ACADEMY OF HUMANITIES AND THE ARTS,Old Roosevelt Field Contaminated Ground Water Area,1.2446019290476733,11550,NY,HEMPSTEAD,36059,40.716152,-73.623655
Cumberland Preschool Center,"Peterson/Puritan, Inc.",1.2447493731853523,2864,RI,Cumberland,44007,41.94747,-71.427881
OCEAN HILL COLLEGIATE CHARTER SCHOOL,Wolff-Alport Chemical Company,1.2449453012651028,11233,NY,BROOKLYN,36047,40.678117,-73.915894
EAGLE ACADEMY FOR YOUNG MEN II,Wolff-Alport Chemical Company,1.2449453012651028,11233,NY,BROOKLYN,36047,40.678117,-73.915894
Stony Lane El. School,Davisville Naval Construction Battalion Center,1.2453025816523793,2852,RI,North Kingstown,44009,41.593894,-71.486101
BEL AIR ELEMENTARY SCHOOL,Iowa-Nebraska Light & Power Co,1.245315323166646,68701,NE,NORFOLK,31119,42.044079,-97.435395
Hilltop Elementary,Lower Duwamish Waterway,1.2454109276960788,98168,WA,Seattle,53033,47.4928,-122.3009
Frenchtown Elementary,De Rewal Chemical Co.,1.2454440190621876,8825,NJ,FRENCHTOWN,34019,40.534082,-75.062267
IS 318 EUGENIO MARIA DE HOSTOS,Newtown Creek,1.2455541304636224,11206,NY,BROOKLYN,36047,40.7031,-73.9484
Kate Furbish Elementary School,Brunswick Naval Air Station,1.245710577804666,4011,ME,Brunswick,23005,43.916218,-69.954917
Thomas Jefferson School #9,Garfield Ground Water Contamination,1.2460340625282096,7026,NJ,Garfield,34003,40.889743,-74.105245
Veterans Memorial Middle,Former Kil-Tone Company,1.2465877728901955,8360,NJ,VINELAND,34011,39.478658,-75.001955
LIBERTY CITY ELEMENTARY SCHOOL,Continental Cleaners,1.2469302767138586,33147,FL,MIAMI,12086,25.839457,-80.228203
Sojourner Truth Middle School,U.S. Radium Corp.,1.2469671374766462,7017,NJ,EAST ORANGE,34013,40.771873,-74.208297
Cougar Valley Elementary,Bangor Naval Submarine Base,1.2470237988614412,98383,WA,SILVERDALE,53035,47.683,-122.7257
Greenbelt Elementary,Beltsville Agricultural Research Center (USDA),1.2470893421181068,20770,MD,Greenbelt,24033,39.0122,-76.8771
Washington Connections Academy - Mary M. Knight,Palermo Well Field Ground Water Contamination,1.2479030967905869,98501,WA,Tumwater,53067,46.983519,-122.90416
BIRCHCREST ELEMENTARY SCHOOL,PCE - Carriage Cleaners,1.2479243048171997,68005,NE,BELLEVUE,31153,41.147815,-95.914018
BELTON EARLY CHILDHOOD SCHOOL,Rockwool Industries Inc.,1.2479918257547264,76513,TX,BELTON,48027,31.058953,-97.45737
Allegan High School,Rockwell International Corp. (Allegan Plant),1.2480708724165512,49010,MI,ALLEGAN,26005,42.5301,-85.8729
Highland School,Billings PCE,1.2490022354659904,59102,MT,Billings,30111,45.790175,-108.534844
MARSHALL MIDDLE,South Cavalcade Street,1.2493321198972727,77009,TX,HOUSTON,48201,29.78214,-95.357137
Saddle Brook Middle/High School,Maywood Chemical Co.,1.2494757066084223,7663,NJ,SADDLE BROOK,34003,40.905038,-74.090397
Kingston Hill Academy,West Kingston Town Dump/URI Disposal Area,1.2494801498971317,2874,RI,Saunderstown,44009,41.499095,-71.511232
Vinland Elementary,Bangor Ordnance Disposal (USNAVY),1.2498048488637419,98370,WA,Poulsbo,53035,47.7638,-122.6742
Lou Henry Hoover School of Fine Arts,Omega Chemical Corporation,1.2499617551777642,90601,CA,Whittier,6037,33.9845,-118.0297
Colgate Elementary,Kane & Lombard Street Drums,1.2501873071545127,21224,MD,Baltimore,24005,39.294796,-76.518379
Yu Ming Charter,AMCO Chemical,1.250240327974281,94607,CA,Oakland,6001,37.818013,-122.282138
DOLORES GONZALES ELEMENTARY,Fruit Avenue Plume,1.2502714541236406,87102,NM,ALBUQUERQUE,35001,35.076683,-106.6593
Louise Davy Trahan,Sutton Brook Disposal Area,1.2505767131390315,1876,MA,Tewksbury,25017,42.582,-71.1939
STEVENS PARK EL,RSR Corp.,1.2506851648615998,75211,TX,DALLAS,48113,32.760087,-96.864798
SUNCOAST COMMUNITY HIGH SCHOOL,"Trans Circuits, Inc.",1.2507124249383794,33404,FL,RIVIERA BEACH,12099,26.77836,-80.081529
Bountiful Jr High,Bountiful/Woods Cross 5th South PCE Plume,1.2513178939065803,84010,UT,BOUNTIFUL,49011,40.894172,-111.881665
Hillside Intermediate School,"Laurel Park, Inc.",1.2513514188920707,6770,CT,Naugatuck,9140,41.491779,-73.05792
Edison High,McCormick & Baxter Creosoting Co.,1.2515470450478803,95206,CA,Stockton,6077,37.937163,-121.288034
Lincoln Elementary School,Rockaway Township Wells,1.2516759652016114,7866,NJ,ROCKAWAY,34027,40.8977,-74.5111
Sandoval Sr High School,Sandoval Zinc Company,1.251913007326512,62882,IL,Sandoval,17121,38.616997,-89.131042
Sandoval Jr High School,Sandoval Zinc Company,1.251913007326512,62882,IL,Sandoval,17121,38.616997,-89.131042
Cherokee Elementary School,Diamond Shamrock Corp. Landfill,1.252211666652418,30125,GA,Cedartown,13233,34.0368,-85.2618
RIDGE MILLS ELEMENTARY SCHOOL,Griffiss Air Force Base,1.2523241150707827,13440,NY,ROME,36065,43.2415,-75.4389
East Dubuque Elem School,Peoples Natural Gas Co.,1.2523274045899844,61025,IL,East Dubuque,17085,42.4971,-90.6369
Passaic Arts and Science Charter School,Garfield Ground Water Contamination,1.2526198993626942,7410,NJ,Passaic,34031,40.858977,-74.123275
Jefferson Elementary,Janesville Old Landfill,1.2527371532361447,53545,WI,Janesville,55105,42.7017,-88.9989
IR PREP,Piper Aircraft Corp./Vero Beach Water & Sewer Department,1.2531879884816322,32960,FL,VERO BEACH,12061,27.635495,-80.40021
Columbian Elementary School,Colorado Smelter,1.2534936523461297,81004,CO,PUEBLO,8101,38.2455,-104.6308
Lugo Elementary,Jervis B. Webb Co.,1.253595327549703,90262,CA,Lynwood,6037,33.9331,-118.1846
Dover High School,Dover Municipal Well 4,1.2541617319447882,7801,NJ,DOVER,34027,40.8979,-74.5602
Brooklyn Center ECSE Age 3 - 5,FMC Corp. (Fridley Plant),1.254389166656471,55430,MN,BROOKLYN CENTER,27053,45.063049,-93.30013
Early Childhood Special Education (,FMC Corp. (Fridley Plant),1.254389166656471,55430,MN,BROOKLYN CENTER,27053,45.063049,-93.30013
Brooklyn Center Elementary School,FMC Corp. (Fridley Plant),1.254389166656471,55430,MN,BROOKLYN CENTER,27053,45.063049,-93.30013
Early Childhood Development Center,"Martin Aaron, Inc.",1.2544282109537452,8103,NJ,CAMDEN,34007,39.937581,-75.100787
Plainfield Central School,Gallup's Quarry,1.2544360223198305,6374,CT,Plainfield,9150,41.682583,-71.931079
Richey Elementary School,"Koppers Co., Inc. (Newport Plant)",1.254485284672442,19804,DE,Wilmington,10003,39.717838,-75.607883
Brookland Middle,"Rentokil, Inc. (Virginia Wood Preserving Division)",1.254999050244525,23228,VA,Richmond,51087,37.642,-77.4819
Margaret C. Clifford School,"Matlack, Inc.",1.2553382248129268,8085,NJ,SWEDESBORO,34015,39.746273,-75.313649
Lincoln High School,Lot 46 Valley Gardens TCE,1.2553811517698936,50315,IA,Des Moines,19153,41.561995,-93.626682
Polk Street School,Quanta Resources,1.2557813185193005,7047,NJ,North Bergen,34017,40.79805,-74.011821
Marie Durand Elementary School,Shieldalloy Corp.,1.2559450991607148,8360,NJ,VINELAND,34011,39.5258,-75.0291
Waukegan High School,Outboard Marine Corp.,1.2562088228344608,60085,IL,Waukegan,17097,42.358822,-87.844184
Mead Open Doors,Kaiser Aluminum (Mead Works),1.2563790915739992,99021,WA,Mead,53063,47.773307,-117.375704
Pathway School of Discovery,Valley Pike VOCs,1.2565633129780007,45404,OH,Dayton,39113,39.795599,-84.156233
Washington Elementary School,"Interstate Pollution Control, Inc.",1.2566672815933446,61102,IL,Rockford,17201,42.257688,-89.107508
Students Transitioning and Achieving Real Success,Fair Lawn Well Field,1.2566737054344272,7504,NJ,PATERSON,34031,40.919453,-74.132874
Paterson STEAM High School,Fair Lawn Well Field,1.2566737054344272,7514,NJ,PATERSON,34031,40.919453,-74.132874
North Elem School,Central Illinois Public Service Co.,1.2566764453111423,62568,IL,Taylorville,17021,39.5578,-89.2912
PS 163 ALFRED E SMITH,Quanta Resources,1.2567406730519843,10025,NY,NEW YORK,36061,40.7947,-73.9687
BROOKLYN PREPARATORY HIGH SCHOOL,Newtown Creek,1.2567659223365077,11211,NY,BROOKLYN,36047,40.7155,-73.9549
WILLIAMSBURG PREPARATORY SCHOOL,Newtown Creek,1.2567659223365077,11211,NY,BROOKLYN,36047,40.7155,-73.9549
WILLIAMSBURG HIGH SCHOOL FOR ARCHITECTURE AND DESIGN,Newtown Creek,1.2567659223365077,11211,NY,BROOKLYN,36047,40.7155,-73.9549
PS 34 OLIVER H PERRY,Newtown Creek,1.2570602515607663,11222,NY,BROOKLYN,36047,40.7264,-73.9497
Center for Talent Development at Greenlee,Denver Radium Site,1.2571127370899198,80204,CO,DENVER,8031,39.7347,-105.0012
Forest Elementary School,McLouth Steel Corp,1.2571645220752616,48193,MI,RIVERVIEW,26163,42.1663,-83.1943
Ellen R Hathaway,New Bedford Site,1.2575272348009214,2740,MA,New Bedford,25005,41.633168,-70.940276
Mary W. Jackson STEAM Multilingual Magnet Elementary,Jet Propulsion Laboratory (NASA),1.2578504240373083,91001,CA,Altadena,6037,34.183411,-118.163196
PS 81 JEAN PAUL RICHTER,Newtown Creek,1.2580439728734236,11385,NY,GLENDALE,36081,40.7038,-73.912
Riverview Early Childhood Center,McLouth Steel Corp,1.2582972260603618,48193,MI,RIVERVIEW,26163,42.166252,-83.194345
Hoover Elementary School,Mason City Coal Gasification Plant,1.2583321352385304,50401,IA,Mason City,19033,43.158493,-93.219209
Davenport El Sch,Tysons Dump,1.2584628508734463,19401,PA,Norristown,42091,40.119191,-75.341157
Wallace H Braden Middle School,Fields Brook,1.2585925841927255,44004,OH,Ashtabula,39007,41.873692,-80.770967
Silvermine Dual Language Magnet School,Kellogg-Deering Well Field,1.2591353074613503,6850,CT,Norwalk,9190,41.147463,-73.440613
INTERNATIONAL HIGH SCHOOL AT LAGUARDIA COMMUNITY COLLEGE,Meeker Avenue Plume,1.2594192795651833,11101,NY,LONG ISLAND CITY,36081,40.743416,-73.933491
MIDDLE COLLEGE HIGH SCHOOL AT LAGUARDIA COMMUNITY COLLEGE,Meeker Avenue Plume,1.2594192795651833,11101,NY,LONG ISLAND CITY,36081,40.743416,-73.933491
Wilson Avenue School,Diamond Alkali Co.,1.2600921484097782,7108,NJ,NEWARK,34013,40.7276,-74.1541
Sparks Elementary,San Gabriel Valley (Area 4),1.260401521173765,91744,CA,La Puente,6037,34.0348,-117.9593
Edison Early Learning Center,Chemical Insecticide Corp.,1.2604439668375125,8817,NJ,Edison,34023,40.514324,-74.384705
Tillicum Elementary School,American Lake Gardens/McChord AFB,1.2605108742395095,98498,WA,Lakewood,53053,47.1251,-122.5533
Cumberland School,Adam's Plating,1.2611144556271427,48906,MI,LANSING,26065,42.7576,-84.5879
KIPP North Star Primary,Joslyn Manufacturing & Supply Co.,1.261325088168802,55430,MN,MINNEAPOLIS,27053,45.046839,-93.307674
BROOKSHIRE ELEMENTARY,"City Industries, Inc.",1.2613790392856834,32792,FL,WINTER PARK,12095,28.592807,-81.318307
MACHANANAO ELEMENTARY SCHOOL,Andersen Air Force Base,1.2614628410182518,96929,GU,YIGO,66010,13.583592,144.882592
Somerset Elementary Academy,American Cyanamid Co.,1.2616780250735402,8807,NJ,Bridgewater,34035,40.557239,-74.583528
The Career Center of the SCESC,American Cyanamid Co.,1.2616780250735402,8807,NJ,Bridgewater,34035,40.557239,-74.583528
Somerset Secondary Academy,American Cyanamid Co.,1.2616780250735402,8807,NJ,Bridgewater,34035,40.557239,-74.583528
Swanson Traditional School,"Douglas Road/Uniroyal, Inc., Landfill",1.2617711573111674,46635,IN,South Bend,18141,41.7254,-86.2108
Saegertown El Sch,Saegertown Industrial Area,1.262040327263683,16433,PA,Saegertown,42039,41.723718,-80.166658
Lincoln Elementary School,Peoples Natural Gas Co.,1.2620929975091695,52001,IA,Dubuque,19061,42.497544,-90.68139
South Gate Middle,Southern Avenue Industrial Area,1.2626844533290928,90280,CA,South Gate,6037,33.952501,-118.197687
KIPP North Star Academy,Joslyn Manufacturing & Supply Co.,1.2631563136363189,55430,MN,MINNEAPOLIS,27053,45.046765,-93.307626
BAYLOR COLLEGE OF MEDICINE BIOTECH ACADEMY AT RUSK,"Many Diversified Interests, Inc.",1.2638541338016542,77003,TX,HOUSTON,48201,29.753366,-95.344679
Elizabeth Avenue School,Brook Industrial Park,1.2639219205420285,8873,NJ,Somerset,34035,40.542047,-74.534022
Glen Flora Elem School,Outboard Marine Corp.,1.2639658556108109,60085,IL,Waukegan,17097,42.375637,-87.841549
Wyoming High School,Chem Central,1.2639785475978436,49509,MI,WYOMING,26081,42.9094,-85.6992
Wilson School,Garfield Ground Water Contamination,1.2643224071405494,7644,NJ,LODI,34003,40.8759,-74.0827
Northeast Elementary School,Michner Plating - Mechanic Street,1.2653668137698324,49202,MI,JACKSON,26075,42.2659,-84.3888
Collierville Elementary School,"Walker Machine Products, Inc.",1.2655069058133999,38017,TN,Collierville,47157,35.055858,-89.667447
East Fairmont Middle School,Sharon Steel Corp (Fairmont Coke Works),1.2658643442803321,26554,WV,Fairmont,54049,39.480541,-80.131057
YOUNG WOMEN'S LEADERSHIP SCHOOL,Quanta Resources,1.2661090182123347,10025,NY,NEW YORK,36061,40.797126,-73.966793
Chattanooga School for the Arts and Sciences Lower,Southside Chattanooga Lead,1.2661578619474594,37403,TN,Chattanooga,47065,35.0502,-85.295
Chattanooga School for the Arts and Sciences Upper,Southside Chattanooga Lead,1.2661578619474594,37403,TN,Chattanooga,47065,35.0502,-85.295
Brunswick High School,Hercules 009 Landfill,1.2664075525295246,31520,GA,Brunswick,13127,31.186827,-81.489309
Brown School,Bendix Corp./Allied Automotive,1.2665035466523207,49085,MI,SAINT JOSEPH,26021,42.0665,-86.5032
POLK STREET SCHOOL,Genzale Plating Co.,1.266692978964334,11010,NY,FRANKLIN SQUARE,36059,40.6971,-73.6774
Vincent Middle High School,"Alabama Plating Company, Inc.",1.266743189661182,35178,AL,Vincent,1117,33.383227,-86.414454
Midway Elementary,Seattle Municipal Landfill (Kent Highlands),1.2669799861186213,98198,WA,Des Moines,53033,47.3998,-122.3033
Mad River Middle School,North Sanitary Landfill,1.2671751491761478,45424,OH,Dayton,39113,39.793644,-84.130627
MAPLE AVENUE MIDDLE SCHOOL,Niagara Mohawk Power Corp. (Saratoga Spings Plant),1.2673367861250613,12866,NY,SARATOGA SPRINGS,36091,43.108179,-73.773734
Cesar E. Chavez Elementary,Pemaco Maywood,1.2673863733746933,90201,CA,Bell Gardens,6037,33.9737,-118.1542
Bayside Community Day,March Air Force Base,1.267692653232189,92553,CA,Moreno Valley,6065,33.909033,-117.233711
Moreno Valley Online Academy,March Air Force Base,1.267692653232189,92553,CA,Moreno Valley,6065,33.909033,-117.233711
Paradise Canyon Elementary,Jet Propulsion Laboratory (NASA),1.2679527824000998,91011,CA,La Canada,6037,34.20876,-118.187735
Ellen Ochoa Learning Center,Jervis B. Webb Co.,1.2681842302445447,90201,CA,Cudahy,6037,33.968483,-118.175636
St. Cloud Social Justice Academy,Waite Park Wells,1.2683664378250932,56301,MN,SAINT CLOUD,27145,45.553717,-94.191437
Linwood El Sch,Metro Container Corporation,1.2686384451247066,19061,PA,Linwood,42045,39.824152,-75.42309
Global Learning Charter Public School,New Bedford Site,1.2692387399402258,2746,MA,New Bedford,25005,41.660053,-70.929282
Hook Elementary School,Miami County Incinerator,1.2692483327529096,45373,OH,Troy,39109,40.05606,-84.221379
Walter O. Krumbiegel Middle School,White Chemical Corp.,1.269599058382319,7205,NJ,HILLSIDE,34039,40.6993,-74.2226
LINCOLN ELEMENTARY SCHOOL,Garvey Elevator,1.2696552748657044,68901,NE,HASTINGS,31001,40.576274,-98.398036
Petoskey Montessori Elem School,Petoskey Municipal Well Field,1.2701725295989303,49770,MI,PETOSKEY,26047,45.3737,-84.9381
Mt. Anthony Union Middle School,Bennington Municipal Sanitary Landfill,1.2702112240433783,5201,VT,Bennington,50003,42.90544,-73.187741
CENTRAL ELEMENTARY,Griggs & Walnut Ground Water Plume,1.2702582611445676,88005,NM,LAS CRUCES,35013,32.309702,-106.780681
PS 319,Newtown Creek,1.2708340890850434,11211,NY,BROOKLYN,36047,40.7096,-73.954
NEW TECH H S AT B F DARRELL H S,"Lane Plating Works, Inc.",1.2711033290174951,75216,TX,DALLAS,48113,32.691528,-96.790989
GLOBAL LEADERSHIP ACADEMY,Van der Horst USA Corporation,1.2711345035037822,75160,TX,TERRELL,48257,32.740922,-96.2943
TERRELL ALTERNATIVE EDUCATION CENTER/PHOENIX SCH,Van der Horst USA Corporation,1.2711345035037822,75160,TX,TERRELL,48257,32.740922,-96.2943
Elmwood Academy,Navy Ships Parts Control Center,1.2711386229910269,17055,PA,Mechanicsburg,42041,40.2069,-77.0025
Miller Elementary,Tomah Municipal Sanitary Landfill,1.2717080707066781,54660,WI,Tomah,55081,43.979204,-90.507644
TS Nurnberger Middle School,Gratiot County Landfill,1.2718041022970472,48880,MI,SAINT LOUIS,26057,43.4127,-84.6019
Nelson Elementary,San Gabriel Valley (Area 4),1.2719204615285813,91744,CA,La Puente,6037,34.0338,-117.9662
East High,Former Custom Cleaners,1.2723088625218482,38111,TN,Memphis,47157,35.1318,-89.9543
Matthew Thornton Elementary School,Tinkham Garage,1.2724212423566763,3053,NH,Londonderry,33015,42.866068,-71.375263
Clayton Middle,700 South 1600 East PCE Plume,1.2724223016754912,84108,UT,SALT LAKE CITY,49035,40.737487,-111.83735
Wahiawa Elementary School,Naval Computer and Telecommunications Area Master Station Eastern Pacific,1.2724969180616885,96786,HI,Wahiawa,15003,21.504836,-158.017923
Cameron Elementary,San Gabriel Valley (Area 2),1.2728689193780018,91790,CA,West Covina,6037,34.0619,-117.9189
VIRTUAL ACADEMY OF NORTH TEXAS,Air Force Plant #4 (General Dynamics),1.2732008765395977,76108,TX,WHITE SETTLEMENT,48439,32.759422,-97.450632
A-TECH HIGH SCHOOL,Newtown Creek,1.273251882517596,11222,NY,BROOKLYN,36047,40.7223,-73.9533
BABLER ELEM.,Ellisville Site,1.2734869271553746,63038,MO,GLENCOE,29189,38.599674,-90.641607
GREAT NECK NORTH HIGH SCHOOL,Stanton Cleaners Area Ground Water Contamination,1.2741229798564595,11023,NY,GREAT NECK,36059,40.800082,-73.7403
EAGLE POINT ELEMENTARY SCHOOL,"Mercury Refining, Inc.",1.2743520371397097,12203,NY,ALBANY,36001,42.6736,-73.8162
Hilltop School,Garfield Ground Water Contamination,1.2750167167806146,7644,NJ,LODI,34003,40.8664,-74.083
Giant Springs Elementary,ACM Smelter and Refinery,1.2751022263846012,59401,MT,Great Falls,30013,47.510581,-111.253032
Hamilton Intermediate School,Riverside Industrial Park,1.2751452690387066,7029,NJ,HARRISON,34017,40.7474,-74.1594
Palmerton Area JHS,Palmerton Zinc Pile,1.2753188858341853,18071,PA,Palmerton,42025,40.8119,-75.6074
Barringer High School,Riverside Industrial Park,1.2755118845995363,7104,NJ,NEWARK,34013,40.755925,-74.179805
Juan Cabrillo Middle,Intel Magnetics,1.2756992377235359,95051,CA,Santa Clara,6085,37.3583,-121.9724
Eugene M Nikkari Elementary,Gratiot County Golf Course,1.2760118430434804,48880,MI,SAINT LOUIS,26057,43.4,-84.6103
Linden Avenue School,U.S. Radium Corp.,1.2768537051094886,7028,NJ,GLEN RIDGE,34013,40.793,-74.2096
Jefferson Elementary School,Mason City Coal Gasification Plant,1.277168848126087,50401,IA,Mason City,19033,43.1474,-93.1738
YINGHUA ACADEMY,Southeast Hennepin Area Groundwater and Vapor,1.2772437888365409,55413,MN,MINNEAPOLIS,27053,45.004572,-93.240127
Benjamin Franklin Elem School,Elm Street Ground Water Contamination,1.2779321194110853,47807,IN,Terre Haute,18167,39.4761,-87.3902
Abram P. Morris Early Childhood Center,White Chemical Corp.,1.2782543347098714,7205,NJ,HILLSIDE,34039,40.6916,-74.221
Northview Elem,"Chemical Commodities, Inc.",1.2783566589658397,66061,KS,Olathe,20091,38.895122,-94.814811
Department of Human Resources,Westside Lead,1.2784148637339077,30303,GA,Atlanta,13121,33.7542,-84.3906
Randle Highlands ES,Washington Navy Yard,1.2785568537622054,20020,DC,Washington,11001,38.870207,-76.964391
Downtown School,Lot 46 Valley Gardens TCE,1.2790109080314933,50309,IA,Des Moines,19153,41.583967,-93.642119
Virtual Campus,Lot 46 Valley Gardens TCE,1.2790109080314933,50309,IA,Des Moines,19153,41.583967,-93.642119
Pyne Arts,Silresim Chemical Corp.,1.2791577749791374,1852,MA,Lowell,25017,42.627071,-71.288762
KELLOGG MIDDLE SCHOOL,Bunker Hill Mining & Metallurgical Complex,1.279389415676788,83837,ID,KELLOGG,16079,47.544123,-116.134572
Willow School,Adam's Plating,1.2798971342810648,48915,MI,LANSING,26065,42.7493,-84.5664
Faulconer-Chapman School,Taylor Lumber and Treating,1.2801908861429296,97378,OR,Sheridan,41071,45.092112,-123.40176
Wyoming Intermediate,Chem Central,1.2809870724308297,49509,MI,WYOMING,26081,42.905,-85.6986
Liberty High School,Behr Dayton Thermal System VOC Plume,1.2810830373725053,45402,OH,Dayton,39113,39.766327,-84.175211
INTERNATIONAL STUDIES ACADEMY MIDDLE SCHOOL,Petroleum Products Corp.,1.281145615457905,33143,FL,MIAMI,12011,26.009642,-80.161026
INTERNATIONAL STUDIES ACADEMY HIGH SCHOOL,Petroleum Products Corp.,1.281145615457905,33143,FL,MIAMI,12011,26.009642,-80.161026
SAM HOUSTON EL,Northwest Odessa Groundwater,1.2815596342019162,79762,TX,ODESSA,48135,31.877515,-102.380021
YORK HIGH SCHOOL,PCE/TCE Northeast Contamination,1.2815852922107054,68467,NE,YORK,31185,40.877181,-97.581038
NORTHSIDE ELEMENTARY SCHOOL,Claremont Polychemical,1.2817503029035164,11735,NY,FARMINGDALE,36059,40.739305,-73.446046
Washington School,Scovill Industrial Landfill,1.2821669274897052,6706,CT,Waterbury,9140,41.5434,-73.0337
C. A. WEIS ELEMENTARY SCHOOL,Agrico Chemical Co.,1.2822028610094693,32505,FL,PENSACOLA,12033,30.440792,-87.24343
WEST PREP ACADEMY,Quanta Resources,1.2822534344805019,10025,NY,NEW YORK,36061,40.799225,-73.965462
PS 145 BLOOMINGDALE SCHOOL (THE),Quanta Resources,1.2822534344805019,10025,NY,NEW YORK,36061,40.799225,-73.965462
Franklin Elementary School,Diamond Alkali Co.,1.2824158192036124,7032,NJ,KEARNY,34017,40.7561,-74.1474
DC Prep PCS - Anacostia MS,Washington Navy Yard,1.2824173155900334,20020,DC,Washington,11001,38.856663,-76.985316
Juana Briones Elementary,Hewlett-Packard (620-640 Page Mill Road),1.2829033992208931,94306,CA,Palo Alto,6085,37.40715,-122.128474
Thornton Fractnl No High School,Estech General Chemical Company,1.2830039369712831,60409,IL,Calumet City,17031,41.614617,-87.543647
Cape May Regional School,Williams Property,1.2830421604153344,8210,NJ,CAPE MAY COURT HOUSE,34009,39.0989,-74.7992
Cordova Middle,National Fireworks,1.2830849590217752,38018,TN,Cordova,47157,35.1489,-89.7697
Ordway Elementary,Wyckoff Co./Eagle Harbor,1.2831341231256816,98110,WA,Bainbridge Island,53035,47.64,-122.5221
Wallace Elementary School,Continental Steel Corp.,1.2832121579829796,46901,IN,Kokomo,18067,40.4916,-86.1643
Kokomo Virtual Academy,Continental Steel Corp.,1.2832945433993312,46902,IN,Kokomo,18067,40.455749,-86.157351
Kokomo High School,Continental Steel Corp.,1.2832945433993312,46902,IN,Kokomo,18067,40.455749,-86.157351
Cedarlane Academy,San Gabriel Valley (Area 4),1.2835808865372897,91745,CA,Hacienda Heights,6037,33.9991,-117.9513
Dickinson Fine Arts Academy,Beck's Lake,1.2835945736980723,46628,IN,South Bend,18141,41.6929,-86.3092
Wissahickon SHS,BoRit Asbestos,1.2836343469050584,19002,PA,Ambler,42091,40.1719,-75.2278
Charlotte M Murkland Elementary,Silresim Chemical Corp.,1.284227310057378,1854,MA,Lowell,25017,42.64664,-71.32099
Northview Next Career Center,"State Disposal Landfill, Inc.",1.2843582487440897,49525,MI,GRAND RAPIDS,26081,43.0319,-85.5907
FARMINGDALE SENIOR HIGH SCHOOL,Liberty Industrial Finishing,1.2845407592692313,11735,NY,FARMINGDALE,36059,40.7081,-73.4444
