NAME,Site_Name,distance_to_site_miles,ZIP,STATE,CITY,CNTY,LAT,LON
Coronado High School,Indian Bend Wash Area,0.872246788442304,85257,AZ,SCOTTSDALE,4013,33.47492,-111.919771
Griffith Elementary School,"Motorola, Inc. (52nd Street Plant)",0.8730005688431594,85008,AZ,PHOENIX,4013,33.4686,-111.9835
College Connection Academy,Lorentz Barrel & Drum Co.,0.8730370206633429,95122,CA,San Jose,6085,37.320398,-121.848558
Luis Valdez Leadership Academy,Lorentz Barrel & Drum Co.,0.8730370206633429,95122,CA,San Jose,6085,37.320398,-121.848558
LEAP HS Summer,Koppers Coke,0.8730578247053441,55104,MN,SAINT PAUL,27123,44.960681,-93.160022
RICK SCHNEIDER MIDDLE,Geneva Industries/Fuhrmann Energy,0.873149447282155,77075,TX,HOUSTON,48201,29.647332,-95.250394
John Henry High,United Heckathorn Co.,0.8731606272716189,94804,CA,Richmond,6013,37.91302,-122.35499
FOLSOM ELEMENTARY SCHOOL,Arkla Terra Property,0.8733012300585323,33592,FL,THONOTOSASSA,12057,28.047218,-82.32545
Quibbletown Middle School,"Chemsol, Inc.",0.8734817849893814,8854,NJ,PISCATAWAY,34023,40.5735,-74.4514
Mary Bethune Elementary Literature/Technology,Agriculture Street Landfill,0.8740905563393311,70122,LA,New Orleans,22071,29.99248,-90.05408
Hillsboro High School,Eagle Zinc Co Div T L Diamond,0.8741687412532182,62049,IL,Hillsboro,17135,39.1519,-89.4875
PAUL R. SMITH MIDDLE SCHOOL,Stauffer Chemical Co. (Tarpon Springs),0.8743148026911919,34691,FL,HOLIDAY,12101,28.1791,-82.7726
Carlos Pacheco,Sullivan's Ledge,0.8743798394661803,2746,MA,New Bedford,25005,41.65674,-70.940419
Compass Academy Charter School,Former Kil-Tone Company,0.8743979830692445,8360,NJ,Vineland,34011,39.47784,-75.041981
The Woodstock Academy,Linemaster Switch Corp.,0.874434874182519,6281,CT,Woodstock,9150,41.951724,-71.974819
Pickens High,"Sangamo Weston, Inc./Twelve-Mile Creek/Lake Hartwell PCB Contamination",0.8749418694229818,29671,SC,Pickens,45077,34.906272,-82.716288
Oakcrest High School,D'Imperio Property,0.875376222624938,8330,NJ,MAYS LANDING,34001,39.4549,-74.6754
Carver Elementary School,American Creosote DeRidder,0.8753811193442588,70634,LA,DeRidder,22011,30.843857,-93.272723
HAMILTON ELEMENTARY SCHOOL,Sanford Dry Cleaners,0.8756604979992065,32771,FL,SANFORD,12117,28.804832,-81.253135
EVIT - Scottsdale Vocational Center,Indian Bend Wash Area,0.8772023025487871,85257,AZ,SCOTTSDALE,4013,33.474838,-111.91997
GEO Next Generation Academy,Keystone Corridor Ground Water Contamination,0.8775070971429266,46226,IN,Indianapolis,18097,39.830671,-86.105901
The Genius School,Keystone Corridor Ground Water Contamination,0.8775070971429266,46226,IN,Indianapolis,18097,39.830671,-86.105901
Mary Daly Elementary School,Lusher Street Ground Water Contamination,0.8775426392208073,46514,IN,Elkhart,18039,41.6848,-86.002
LAKE PARK ELEMENTARY SCHOOL,"Trans Circuits, Inc.",0.8780632609949952,33403,FL,LAKE PARK,12099,26.796136,-80.059805
Puente Hills High,San Gabriel Valley (Area 4),0.8781416534354753,91746,CA,Hacienda Heights,6037,34.010776,-117.971939
Goshen High School,North 5th Street Groundwater Contamination,0.8782271207059844,46526,IN,Goshen,18039,41.580589,-85.823145
SOLVAY HIGH SCHOOL,Onondaga Lake,0.8782544790449116,13209,NY,SOLVAY,36067,43.058,-76.2155
Abraham Lincoln Elementary School,Estech General Chemical Company,0.8786826145472506,46327,IN,Hammond,18089,41.637,-87.5145
Washington School,"Curcio Scrap Metal, Inc.",0.8791782189541903,7663,NJ,Saddle Brook,34003,40.8967,-74.0886
PS 18 EDWARD BUSH,Newtown Creek,0.8793564968816703,11206,NY,BROOKLYN,36047,40.7108,-73.9466
Columbia Middle,"TRW Microwave, Inc. (Building 825)",0.8798114705288917,94085,CA,Sunnyvale,6085,37.3937,-122.0197
Lodi High School,"Curcio Scrap Metal, Inc.",0.8808159579496257,7644,NJ,LODI,34003,40.8872,-74.0872
Christopher Columbus School #8,"Curcio Scrap Metal, Inc.",0.8808436219105664,7026,NJ,GARFIELD,34003,40.8787,-74.1089
The Excel Center,Memphis Defense Depot (DLA),0.8813620742959626,38106,TN,Memphis,47157,35.083508,-90.013246
Renton Senior High School,Pacific Car & Foundry Co.,0.8815529442521115,98055,WA,Renton,53033,47.4817,-122.2119
Fountaindale Elementary,Central Chemical (Hagerstown),0.8819568766951988,21742,MD,Hagerstown,24043,39.6687,-77.7184
Cinnaminson High School,Cinnaminson Township (Block 702) Ground Water Contamination,0.8820177756494844,8077,NJ,CINNAMINSON,34005,40.0075,-74.9965
BURNETT MIDDLE SCHOOL,Taylor Road Landfill,0.8825855953465864,33584,FL,SEFFNER,12057,28.007632,-82.27885
Valley Community Day,San Gabriel Valley (Area 4),0.8826316127938556,91745,CA,Hacienda Heights,6037,34.010809,-117.972049
Valley Alternative High (Continuation),San Gabriel Valley (Area 4),0.8826316127938556,91745,CA,Hacienda Heights,6037,34.010809,-117.972049
COLLINS EL,Crystal Chemical Co.,0.882668091185022,77036,TX,HOUSTON,48201,29.710905,-95.554801
AGUEDA JOHNSTON MIDDLE SCHOOL,Ordot Landfill,0.8827915103403425,96910,GU,ORDOT,66010,13.445724,144.758221
FREDERICKTOWN ELEM.,Madison County Mines,0.8828160435625027,63645,MO,FREDERICKTOWN,29123,37.554252,-90.288556
BROWNSVILLE COLLEGIATE  CHARTER SCHOOL,Newtown Creek,0.883256542826726,11206,NY,BROOKLYN,36047,40.707072,-73.943801
Shirakawa (George Sr.) Elementary,Lorentz Barrel & Drum Co.,0.8841079150987793,95112,CA,San Jose,6085,37.3149,-121.8489
Hudson Arts and Science Charter School,Riverside Industrial Park,0.8842640239164109,7032,NJ,Kearny,34017,40.77013,-74.143141
Vestaburg Community Alternative Education School  Wyoming,Chem Central,0.8845328882129619,49509,MI,WYOMING,26081,42.899085,-85.683204
HARRY STONE MONTESSORI ACADEMY,"Lane Plating Works, Inc.",0.8845545169992058,75216,TX,DALLAS,48113,32.693459,-96.783221
ACADEMIR CHARTER SCHOOL OF MATH AND SCIENCE,Homestead Air Force Base,0.8848390100264111,33030,FL,HOMESTEAD,12086,25.499345,-80.406017
ACADEMIR MIDDLE SCHOOL OF MATH AND SCIENCE,Homestead Air Force Base,0.8848390100264111,33033,FL,HOMESTEAD,12086,25.499345,-80.406017
Granite Preschool,Wasatch Chemical Co. (Lot 6),0.8848495014696783,84115,UT,SALT LAKE CITY,49035,40.716144,-111.889344
Headstart Preschool Special Education,Wasatch Chemical Co. (Lot 6),0.8848495014696783,84115,UT,SALT LAKE CITY,49035,40.716144,-111.889344
Granite Technical Institute,Wasatch Chemical Co. (Lot 6),0.8848495014696783,84115,UT,SALT LAKE CITY,49035,40.716144,-111.889344
Southington High School,Solvents Recovery Service of New England,0.8851549242486827,6489,CT,Southington,9110,41.6168,-72.8612
Cheston El Sch,Industrial Lane,0.8853109389486944,18042,PA,Easton,42095,40.676,-75.2184
Malcolm White,Wells G&H,0.8854037937052444,1801,MA,Woburn,25017,42.484743,-71.141696
VALLEY STREAM SOUTH HIGH SCHOOL,Peninsula Boulevard Ground Water Plume,0.8859684225055948,11581,NY,VALLEY STREAM,36059,40.6542,-73.714
HOMESTEAD SCHOOL,Genzale Plating Co.,0.8859711490989445,11530,NY,GARDEN CITY,36059,40.727704,-73.673868
ANDREW T MORROW SCHOOL,Islip Municipal Sanitary Landfill,0.8859816190032903,11749,NY,ISLANDIA,36103,40.806,-73.1765
Eleanor N Johnson Middle,Blackburn and Union Privileges,0.8860261394471816,2081,MA,Walpole,25021,42.150981,-71.256564
East Side High School,Pierson's Creek,0.8878814345764777,7105,NJ,NEWARK,34013,40.724,-74.1588
Northside Elementary School,T.H. Agriculture & Nutrition Co. (Albany Plant),0.888104792870269,31701,GA,Albany,13095,31.6061,-84.1744
PARK AVENUE SCHOOL,New Cassel/Hicksville Ground Water Contamination,0.8881859822817828,11590,NY,WESTBURY,36059,40.764928,-73.563344
Van Deene Avenue Elementary,Montrose Chemical Corp.,0.8891033671354287,90502,CA,Torrance,6037,33.838121,-118.2889
Appleton Technical Academy,"N.W. Mauthe Co., Inc.",0.8897103048249909,54914,WI,Appleton,55087,44.2683,-88.4278
PS 123 SUYDAM,Newtown Creek,0.8897671206917781,11237,NY,BROOKLYN,36047,40.704,-73.9225
Sussex Academy,Georgetown North Groundwater,0.8903453352435919,19947,DE,Georgetown,10005,38.697175,-75.368097
Bdote Learning Center,South Minneapolis Residential Soil Contamination,0.8904091746340649,55406,MN,MINNEAPOLIS,27053,44.950418,-93.224829
BOULWARE SPRINGS CHARTER,Cabot/Koppers,0.8906853945987455,32609,FL,GAINESVILLE,12001,29.6733,-82.308376
South Plainfield Middle School,"Cornell Dubilier Electronics, Inc.",0.8918549156248612,7080,NJ,SOUTH PLAINFIELD,34023,40.589,-74.4172
Bishop Elementary,"TRW Microwave, Inc. (Building 825)",0.8920004090367005,94085,CA,Sunnyvale,6085,37.386824,-122.024619
Lee Montessori PCS - East End,Washington Navy Yard,0.8921118465127825,20020,DC,Washington,11001,38.869276,-76.972557
Manasquan High School,White Swan Cleaners/Sun Cleaners Area Ground Water Contamination,0.8926422421430612,8736,NJ,Manasquan,34025,40.1282,-74.0491
ROOSEVELT ELEMENTARY,Lehillier/Mankato Site,0.8927085710370506,56001,MN,MANKATO,27013,44.157679,-94.021369
Kipp WAYS Primary Charter School,Westside Lead,0.8928722794208725,30314,GA,Atlanta,13121,33.76452,-84.422721
KIPP WAYS Academy Charter School,Westside Lead,0.8928722794208725,30314,GA,Atlanta,13121,33.76452,-84.422721
Therapeutic Education Collective (T,Oakdale Dump,0.8930885727830818,55128,MN,OAKDALE,27163,44.987481,-92.962179
Mahatma K. Gandhi School,PJP Landfill,0.8931296026045545,7306,NJ,JERSEY CITY,34017,40.7347,-74.0684
Foxview Intermediate,Better Brite Plating Chrome & Zinc Shops,0.8932575488718378,54115,WI,De Pere,55009,44.4441,-88.0595
TAPP CHILDCARE CENTER,Sanford Dry Cleaners,0.8936415579001326,32771,FL,SANFORD,12117,28.802675,-81.25452
TRAVIS INT,United Creosoting Co.,0.8937817230082848,77301,TX,CONROE,48339,30.318729,-95.45733
Upper Moreland MS,Fischer & Porter Co.,0.8943622519475121,19040,PA,Hatboro,42091,40.1713,-75.0891
Natick High,"Natick Laboratory Army Research, Development, and Engineering Center",0.8945099527066591,1760,MA,Natick,25017,42.276102,-71.361577
IDEA JUDSON ACADEMY,"Eldorado Chemical Co., Inc.",0.8949885409991265,78233,TX,SAN ANTONIO,48029,29.562837,-98.36323
IDEA JUDSON COLLEGE PREPARATORY,"Eldorado Chemical Co., Inc.",0.8949885409991265,78233,TX,SAN ANTONIO,48029,29.562837,-98.36323
Venture Academy,Ogden Defense Depot (DLA),0.8951549536652359,84404,UT,MARRIOTT-SLATERVILLE CITY,49057,41.269041,-112.017033
WARD MELVILLE SENIOR HIGH SCHOOL,"Lawrence Aviation Industries, Inc.",0.8956478698814807,11733,NY,EAST SETAUKET,36103,40.9161,-73.0753
Washington High School,Beck's Lake,0.8960158716025203,46619,IN,South Bend,18141,41.6755,-86.3149
Cerritos Elementary,San Fernando Valley (Area 4),0.8961535547600202,91205,CA,Glendale,6037,34.124984,-118.253936
South Plainfield High School,"Cornell Dubilier Electronics, Inc.",0.8963835915405481,7080,NJ,SOUTH PLAINFIELD,34023,40.5892,-74.4124
Le Mars Middle School,Highway 3 PCE,0.8965076698716998,51031,IA,Le Mars,19149,42.780789,-96.172022
Fairfield High School,Fairfield Coal Gasification Plant,0.8967631462271402,52556,IA,Fairfield,19101,41.008336,-91.955342
MARTINEZ C EL,South Cavalcade Street,0.8969244437881703,77009,TX,HOUSTON,48201,29.790269,-95.359508
Cornell El Sch,Ohio River Park,0.897186515753374,15108,PA,Coraopolis,42003,40.508348,-80.162898
Cornell HS,Ohio River Park,0.897186515753374,15108,PA,Coraopolis,42003,40.508348,-80.162898
Brighton Elementary,Norfolk Naval Shipyard,0.8978239027649603,23704,VA,Portsmouth,51740,36.8196,-76.3108
Excel Center - Hammond,MIDCO I,0.8988865244836073,46323,IN,Hammond,18089,41.586907,-87.445526
Paramount School of Excellence South Bend,"Douglas Road/Uniroyal, Inc., Landfill",0.8990639392565355,46635,IN,South Bend,18141,41.70154,-86.200171
ESCAMBIA JUVENILE DETENTION,Agrico Chemical Co.,0.8995066361531324,32501,FL,PENSACOLA,12033,30.44241,-87.236749
GEORGE T. BAKER AVIATION TECHNICAL COLLEGE,Airco Plating Co.,0.8997945463909788,33142,FL,MIAMI,12086,25.804089,-80.263618
Henry P. Becton Regional High School,Ventron/Velsicol,0.8998730784203486,7073,NJ,EAST RUTHERFORD,34003,40.832209,-74.093259
CONSELYEA PREPARATORY SCHOOL,Meeker Avenue Plume,0.9002575662736726,11211,NY,BROOKLYN,36047,40.7148,-73.9458
PS 132 CONSELYEA SCHOOL (THE),Meeker Avenue Plume,0.9002575662736726,11211,NY,BROOKLYN,36047,40.7148,-73.9458
School 18,Fair Lawn Well Field,0.9003336572736153,7524,NJ,PATERSON,34031,40.938038,-74.149273
Camden Prep Inc.,Welsbach & General Gas Mantle (Camden Radiation),0.900693150908057,8104,NJ,Camden,34007,39.925256,-75.106478
Renaissance School,"N.W. Mauthe Co., Inc.",0.9008144021078035,54914,WI,Appleton,55087,44.2685,-88.4283
JASPER H S,Hart Creosoting Company,0.9010934346749032,75951,TX,JASPER,48241,30.9026,-94.0063
CARTHAGE SENIOR HIGH SCHOOL,Black River PCBs,0.901146816243459,13619,NY,CARTHAGE,36045,43.987013,-75.645488
SAVA - Sacramento Academic and Vocational Academy - SCUSD,Sacramento Army Depot,0.9012734307128021,95820,CA,Sacramento,6067,38.5274,-121.409825
Van Cleve Elementary School,West Troy Contaminated Aquifer,0.9013022998581021,45373,OH,Troy,39109,40.037287,-84.196757
Bedford High,Naval Weapons Industrial Reserve Plant,0.9019411041648787,1730,MA,Bedford,25017,42.491402,-71.285535
Hamilton High,Memphis Defense Depot (DLA),0.90241146783001,38106,TN,Memphis,47157,35.100095,-90.017045
Lionheart Classical Academy Chartered Public School,South Municipal Water Supply Well,0.9024287578831582,3458,NH,Peterborough,33011,42.854143,-71.963153
Vera Risdon Middle School,Quendall Terminals,0.9025592008455421,98056,WA,Newcastle,53033,47.540951,-122.184377
NORTH KANSAS CITY HIGH,Armour Road,0.9027970915912543,64116,MO,KANSAS CITY,29047,39.14572,-94.573052
Columbia MS Taylor Campus,UGI Columbia Gas Plant,0.9029519082919968,17512,PA,Columbia,42071,40.038798,-76.494269
Another Course To College,Lower Neponset River,0.9035572666643148,2136,MA,Hyde Park,25025,42.265168,-71.117736
Victory Elementary School,North 25th Street Glass and Zinc,0.9036221737430761,26301,WV,Clarksburg,54033,39.309887,-80.354926
Mildred Magowan Elementary School,Cosden Chemical Coatings Corp.,0.9036516608910651,8010,NJ,EDGEWATER PARK,34005,40.0581,-74.9087
KIPP: Cooper Norcross A New Jersey Nonprofit Corporation,"Martin Aaron, Inc.",0.9038260042848155,8103,NJ,Camden,34007,39.939088,-75.11961
West Goshen Elementary School,North 5th Street Groundwater Contamination,0.9039023922793394,46526,IN,Goshen,18039,41.585,-85.8498
IRONDALE SENIOR HIGH,New Brighton/Arden Hills/TCAAP (USARMY),0.9042376511567248,55112,MN,NEW BRIGHTON,27123,45.090178,-93.207492
DEASY SCHOOL,Li Tungsten Corp.,0.9043405621016581,11542,NY,GLEN COVE,36059,40.871013,-73.629791
Franklin Elementary School,Riverside Industrial Park,0.9043515495322747,7032,NJ,KEARNY,34017,40.7561,-74.1474
General Wayne El Sch,Paoli Rail Yard,0.9046667077578532,19355,PA,Malvern,42029,40.0302,-75.4934
Akili Academy of New Orleans,Agriculture Street Landfill,0.9048239967435634,70122,LA,New Orleans,22071,29.97696,-90.033325
Billings Multilingual Academy,Billings PCE,0.9048837737868264,59101,MT,Billings,30111,45.78412,-108.510827
Billings Early College School,Billings PCE,0.9048837737868264,59101,MT,Billings,30111,45.78412,-108.510827
Billings Opportunity School,Billings PCE,0.9048837737868264,59101,MT,Billings,30111,45.78412,-108.510827
Copeland Middle School,Rockaway Borough Well Field,0.9058069879994879,7866,NJ,ROCKAWAY,34027,40.9179,-74.5221
Wayne County Technology Center,Mallory Capacitor Co.,0.906147648441212,38485,TN,Waynesboro,47181,35.304851,-87.76172
Edgewood Elementary Academy,Peerless Plating Co.,0.906169918590102,49444,MI,MUSKEGON,26121,43.1969,-86.237151
Whitney E. Houston Academy,U.S. Radium Corp.,0.9061868191311424,7017,NJ,EAST ORANGE,34013,40.7809,-74.2112
Grandview Elementary School,Caldwell Trucking Co.,0.906911832889215,7006,NJ,N CALDWELL,34013,40.8741,-74.2542
Madison Preparatory Academy,Capitol Lakes,0.9069228163286677,70802,LA,Baton Rouge,22033,30.4685,-91.17289
United Technical Center,North 25th Street Glass and Zinc,0.90752143195189,26301,WV,Clarksburg,54033,39.309986,-80.355335
Madison Student Support Center,NL Industries/Taracorp Lead Smelter,0.9075262338244534,62060,IL,Madison,17119,38.682688,-90.152781
Lumberton Middle School,Landfill & Development Co.,0.9076111999389946,8048,NJ,LUMBERTON,34005,39.9729,-74.7848
West High,"N.W. Mauthe Co., Inc.",0.9077100064752524,54914,WI,Appleton,55087,44.2686,-88.4283
Haverford SHS,Havertown PCP,0.9079768893943038,19083,PA,Havertown,42045,39.9838,-75.3014
Sterling Montessori Academy,"Koppers Co., Inc. (Morrisville Plant)",0.9081733057908892,27560,NC,Morrisville,37183,35.8335,-78.8374
URBAN ASSEMBLY INSTITUTE OF MATH AND SCIENCE FOR YOUNG WOMEN,Gowanus Canal,0.9086472932416285,11201,NY,BROOKLYN,36047,40.694669,-73.988441
URBAN ASSEMBLY SCHOOL FOR LAW AND JUSTICE (THE),Gowanus Canal,0.9086472932416285,11201,NY,BROOKLYN,36047,40.694669,-73.988441
BOOKER T. WASHINGTON,Griggs & Walnut Ground Water Plume,0.9096508397403998,88001,NM,LAS CRUCES,35013,32.321525,-106.773921
Robert C. Fisler Elementary,McColl,0.9106811898297053,92833,CA,Fullerton,6059,33.8847,-117.9618
LINCOLN ELEMENTARY SCHOOL,Hastings Ground Water Contamination,0.9107647987248095,68901,NE,HASTINGS,31001,40.576274,-98.398036
Jackson River Governor's School,Kim-Stan Landfill,0.9108969310117114,24422,VA,Clifton Forge,51005,37.811273,-79.852563
Bryson Avenue Elementary,Southern Avenue Industrial Area,0.9113188074107826,90280,CA,South Gate,6037,33.944411,-118.19276
McKinley School,Billings PCE,0.9123030381073811,59101,MT,Billings,30111,45.786545,-108.516491
Red Bank Elementary School,"Matteo & Sons, Inc.",0.9124701668232064,8086,NJ,WEST DEPTFORD,34015,39.8677,-75.1659
Wilson Avenue School,Pierson's Creek,0.9127100499294155,7108,NJ,NEWARK,34013,40.7276,-74.1541
Heights High,57th and North Broadway Streets Site,0.9127402511041051,67219,KS,Wichita,20173,37.7798,-97.301
ACADEMY CHARTER SCHOOL-UNIONDALE,Old Roosevelt Field Contaminated Ground Water Area,0.9128508169702931,11553,NY,UNIONDALE,36059,40.726659,-73.603599
Ben Eielson Jr/Sr High School,Eielson Air Force Base,0.9132198854455205,99702,AK,Eielson AFB,2090,64.674796,-147.074375
Owen Valley Community High School,Franklin Street Groundwater Contamination,0.9133292439202314,47460,IN,Spencer,18119,39.2886,-86.781
TEAM Academy Charter School,White Chemical Corp.,0.9138218073269696,7102,NJ,NEWARK,34013,40.711168,-74.202782
HAMLINE ELEMENTARY SCHOOL,Koppers Coke,0.9138301166558834,55104,MN,SAINT PAUL,27123,44.964593,-93.168027
Savoy ES,Washington Navy Yard,0.9141203852643164,20020,DC,Washington,11001,38.8628,-76.993812
FALKENBURG ROAD JAIL,Reeves Southeastern Galvanizing Corp.,0.9146104945419605,33619,FL,TAMPA,12057,27.96012,-82.336411
Elkton High,Dwyer Property Ground Water Plume,0.9148099142638231,21921,MD,Elkton,24015,39.6229,-75.8348
IS 93 RIDGEWOOD,Wolff-Alport Chemical Company,0.914835489760305,11385,NY,RIDGEWOOD,36081,40.7058,-73.9029
Maywood Elementary,Pemaco Maywood,0.9149290420969801,90270,CA,Maywood,6037,33.993315,-118.184101
JAMES S EVANS ELEMENTARY SCHOOL,Wappinger Creek,0.9150251396694754,12590,NY,WAPPINGERS FALLS,36027,41.589296,-73.913424
ANNA MERRITT ELEMENTARY SCHOOL,Eighteenmile Creek,0.9151553689022892,14094,NY,LOCKPORT,36063,43.1741,-78.7048
Hunter Huss High,Davis Park Road TCE,0.9153096009934214,28052,NC,Gastonia,37071,35.2406,-81.2069
Cape May County Technical High School,Williams Property,0.9156828540026729,8210,NJ,CAPE MAY COURT HOUSE,34009,39.104269,-74.79811
Godwin Heights Middle School,Chem Central,0.9160126164393618,49548,MI,GRAND RAPIDS,26081,42.899056,-85.66402
Peter G Schmidt Elementary,Palermo Well Field Ground Water Contamination,0.9161046427182904,98501,WA,Tumwater,53067,46.988367,-122.905296
MOUNDS VIEW SENIOR HIGH,MacGillis & Gibbs/Bell Lumber & Pole Co.,0.9162021584554408,55112,MN,ARDEN HILLS,27123,45.063922,-93.180873
Selkirk Middle School,Greenacres Landfill,0.9162748663679301,99016,WA,Liberty Lake,53063,47.67053,-117.132695
James Mastricola Upper Elementary School,New Hampshire Plating Co.,0.9168373617070735,3054,NH,Merrimack,33011,42.8669,-71.498795
Dry Hollow Elementary School,Union Pacific Railroad Co. Tie-Treating Plant,0.9169375178246186,97058,OR,The Dalles,41065,45.5866,-121.1732
California Avenue Elementary,Riverbank Army Ammunition Plant,0.9172494675903868,95367,CA,Riverbank,6099,37.728534,-120.926146
Charles Street School,Swope Oil & Chemical Co.,0.9173214232939452,8065,NJ,PALMYRA,34005,39.9973,-75.0216
Bonneville School,700 South 1600 East PCE Plume,0.9173981356797167,84108,UT,SALT LAKE CITY,49035,40.744333,-111.835946
Benjamin Franklin Elementary Sch,Federated Metals Corp Whiting,0.9175695857968685,46394,IN,Whiting,18089,41.6844,-87.5036
Thomas W. Wallace Jr. Middle School,"Vineland Chemical Co., Inc.",0.9177242289866187,8360,NJ,VINELAND,34011,39.4979,-75.0626
Eastwood Elementary School,Lane Street Ground Water Contamination,0.9177497101370697,46514,IN,Elkhart,18039,41.721313,-85.904179
Hatboro-Horsham SHS,Willow Grove Naval Air and Air Reserve Station,0.9179144589701224,19044,PA,Horsham,42091,40.197218,-75.163698
ORDOT CHALAN PAGO ELEMENTARY SCHOOL,Ordot Landfill,0.9180205316307831,96910,GU,ORDOT,66010,13.44105,144.760113
Hillandale Elementary,General Electric Co/Shepherd Farm,0.918256333209548,28726,NC,East Flat Rock,37089,35.27157,-82.427475
West Seattle High School,Pacific Sound Resources,0.9182657182766941,98116,WA,SEATTLE,53033,47.5769,-122.3845
Dr. Edward Fitzgerald Elementary,"Rockets, Fireworks, and Flares (RFF)",0.9187836354026561,92377,CA,Rialto,6071,34.165765,-117.423146
HARMONY SCHOOL OF FINE ARTS AND TECHNOLOGY-HOUSTON,Sol Lynn/Industrial Transformers,0.9188843771679311,77054,TX,HOUSTON,48201,29.671596,-95.411406
Millsboro Middle School,NCR Corp. (Millsboro Plant),0.9190130463460608,19966,DE,Millsboro,10005,38.590166,-75.287866
Adult Transition Services,Shiawassee River,0.9190560110202877,48843,MI,HOWELL,26093,42.612392,-83.952376
DODGE ELEMENTARY SCHOOL,Cleburn Street Well,0.9200895886047814,68801,NE,GRAND ISLAND,31079,40.917023,-98.333784
Waverley Elementary,Fort Detrick Area B Ground Water,0.9201275994312076,21702,MD,Frederick,24021,39.4277,-77.4617
School #3,Quanta Resources,0.9203748805912182,7010,NJ,CLIFFSIDE PARK,34003,40.8175,-73.9904
NORTHSIDE ELEMENTARY SCHOOL,Liberty Industrial Finishing,0.9204916610723276,11735,NY,FARMINGDALE,36059,40.739305,-73.446046
Church Creek Elementary,Bush Valley Landfill,0.9205123736577512,21017,MD,Belcamp,24025,39.4754,-76.2483
GULFSTREAM ACADEMY OF HALLANDALE BEACH,Petroleum Products Corp.,0.9211395310205609,33009,FL,HALLANDALE BEACH,12011,25.980717,-80.162632
Vernon Center Middle School,Precision Plating Corp.,0.9213106470662067,6066,CT,Vernon,9110,41.8419,-72.4624
Moccasin Elementary School,Electrovoice,0.9217213013361005,49107,MI,BUCHANAN,26021,41.8324,-86.3627
Arrow Academy of Excellence,Former Custom Cleaners,0.9227759062156179,38111,TN,Memphis,47157,35.1143,-89.9614
Stratford High School,"Raymark Industries, Inc.",0.9228768315092798,6615,CT,Stratford,9120,41.196927,-73.134084
Lincoln International Studies School,"Auto Ion Chemicals, Inc.",0.9228993642043885,49007,MI,KALAMAZOO,26077,42.300424,-85.583004
Bronson JrSr High School,North Bronson Industrial Area,0.9232473478259206,49028,MI,BRONSON,26023,41.868085,-85.186203
Adrian Wilcox High,National Semiconductor Corp.,0.9234105506967722,95051,CA,Santa Clara,6085,37.366,-121.9868
Bishop Elementary,"Advanced Micro Devices, Inc.",0.9234811095816856,94085,CA,Sunnyvale,6085,37.386824,-122.024619
Roosevelt Elementary School,Woodbrook Road Dump,0.9235665411998368,7080,NJ,SOUTH PLAINFIELD,34023,40.570451,-74.416061
Francis T. Evans Elementary,Andrews Air Force Base,0.9237197987670084,20735,MD,Clinton,24033,38.7847,-76.8897
Mancelona Elementary School,Tar Lake,0.9247005557803791,49659,MI,MANCELONA,26009,44.8998,-85.07
Samsel Upper Elementary School,Global Sanitary Landfill,0.9249095699024066,8859,NJ,PARLIN,34023,40.456031,-74.298291
Yavapai Elementary School,Indian Bend Wash Area,0.9249778986939993,85257,AZ,SCOTTSDALE,4013,33.4555,-111.9171
Bobby's Run Elementary School,Landfill & Development Co.,0.9250384414675089,8048,NJ,LUMBERTON,34005,39.973,-74.7853
Marlboro Memorial Middle School,"Imperial Oil Co., Inc./Champion Chemicals",0.9252379501187482,7751,NJ,MORGANVILLE,34025,40.3828,-74.2282
Sheridan Road,"Motor Wheel, Inc.",0.9253818644511829,48906,MI,LANSING,26037,42.7707,-84.5473
Fairwood Elementary School,Chem-Dyne,0.9255923471966686,45011,OH,Hamilton,39017,39.3967,-84.5426
J. Garfield Jackson Sr. Academy,Orange Valley Regional Ground Water Contamination,0.9257846271391205,7017,NJ,EAST ORANGE,34013,40.7694,-74.2144
Carmack,Newmark Ground Water Contamination,0.9262069467765943,92407,CA,San Bernardino,6071,34.171807,-117.329392
Cincinnati Classical Academy,"Pristine, Inc.",0.9264375832547861,45215,OH,Cincinnati,39061,39.23282,-84.42034
Grant Elementary,Sheboygan Harbor & River,0.9270815431565291,53081,WI,Sheboygan,55117,43.7615,-87.7088
Simmons El Sch,Willow Grove Naval Air and Air Reserve Station,0.9272563122056569,19044,PA,Horsham,42091,40.1972,-75.1639
Trinity Day Academy,New Bedford Site,0.928045658144192,2740,MA,New Bedford,25005,41.638919,-70.937008
James Avant Elementary School,Old American Zinc Plant,0.9281269448680551,62204,IL,Washington Pk,17163,38.635559,-90.092792
Columbus School,"Curcio Scrap Metal, Inc.",0.9281340754394953,7644,NJ,LODI,34003,40.8828,-74.0891
PS 39 HENRY BRISTOW,Gowanus Canal,0.9283415809058851,11215,NY,BROOKLYN,36047,40.6687,-73.983
Malaga Elementary,"Purity Oil Sales, Inc.",0.9285462498334944,93725,CA,Fresno,6019,36.6795,-119.7331
Winslow Township Elementary School Five,Lightman Drum Company,0.929595005889419,8009,NJ,BERLIN,34007,39.7198,-74.9177
Doyline High School,Louisiana Army Ammunition Plant,0.9298298380883627,71023,LA,Doyline,22119,32.536458,-93.406521
Eleanor Rush Intermediate School,Cinnaminson Township (Block 702) Ground Water Contamination,0.9299231526859563,8077,NJ,CINNAMINSON,34005,40.0053,-74.9934
A-TECH HIGH SCHOOL,Meeker Avenue Plume,0.9309883755462954,11222,NY,BROOKLYN,36047,40.7223,-73.9533
Herbert Hoover High,San Fernando Valley (Area 2),0.9310022033105674,91202,CA,Glendale,6037,34.166273,-118.270079
