NAME,Site_Name,distance_to_site_miles,ZIP,STATE,CITY,CNTY,LAT,LON
Eastampton Township Community School,Landfill & Development Co.,1.5389845088301528,8060,NJ,EASTAMPTON,34005,39.999,-74.7547
KIPP University Park,McCormick & Baxter Creosoting Co.,1.5390166369701574,95202,CA,Stockton,6077,37.962333,-121.28514
Sayreville War Memorial High School,Horseshoe Road,1.5390542964636573,8859,NJ,PARLIN,34023,40.462731,-74.316372
PS 368,Newtown Creek,1.5394124115425984,11206,NY,BROOKLYN,36047,40.696729,-73.947046
SUCCESS ACADEMY CHARTER SCHOOL - BED STUY 1,Newtown Creek,1.5394124115425984,11206,NY,BROOKLYN,36047,40.696729,-73.947046
Jaime Escalante Elementary,Pemaco Maywood,1.5397945489263374,90201,CA,Cudahy,6037,33.968366,-118.188522
ERNESTINA BRACERO,"Scorpio Recycling, Inc.",1.5401181405595579,951,PR,TOA BAJA,72137,18.416644,-66.210546
El Sol Elementary,"Allied Paper, Inc./Portage Creek/Kalamazoo River",1.5403254859789355,49008,MI,KALAMAZOO,26077,42.284464,-85.591966
Shelia Y. Oliver Academy,Orange Valley Regional Ground Water Contamination,1.5407656648778851,7017,NJ,EAST ORANGE,34013,40.768975,-74.19953
Memphis Street Academy CS @ JP Jones,Franklin Slag Pile (MDC),1.5410379162956043,19134,PA,Philadelphia,42101,39.9863,-75.1129
Pleasantville Elementary School,East Basin Road Groundwater,1.5413890284464797,19720,DE,New Castle,10003,39.667545,-75.62546
Pearl City Highlands School,Pearl Harbor Naval Complex,1.5414919958929028,96782,HI,Pearl City,15003,21.403361,-157.965211
Riverview Elementary School,Chem-Dyne,1.5415461083516238,45011,OH,Hamilton,39017,39.3881,-84.565
West Covina High,San Gabriel Valley (Area 2),1.5415464837504136,91791,CA,West Covina,6037,34.0623,-117.9128
Camellia Elementary,Sacramento Army Depot,1.5415789074445465,95828,CA,Sacramento,6067,38.507858,-121.419572
RAFAEL HERNANDEZ VEGA BAJA,Vega Baja Solid Waste Disposal,1.5415948951730525,693,PR,VEGA BAJA,72145,18.448154,-66.407904
West Side Middle School,Main Street Well Field,1.5420003395272557,46514,IN,Elkhart,18039,41.6856,-86.0054
Theodore Roosevelt Middle,San Fernando Valley (Area 4),1.5423258495412278,91206,CA,Glendale,6037,34.134248,-118.252281
JHS 162 WILLOUGHBY (THE),Meeker Avenue Plume,1.5427162384388604,11237,NY,BROOKLYN,36047,40.7068,-73.9198
GLOBAL ACADEMY,MacGillis & Gibbs/Bell Lumber & Pole Co.,1.5428625503314346,55112,MN,NEW BRIGHTON,27123,45.058244,-93.225955
GREAT NECK NORTH MIDDLE SCHOOL,Stanton Cleaners Area Ground Water Contamination,1.543077468325501,11023,NY,GREAT NECK,36059,40.8035,-73.7431
Student Choice High School,Indian Bend Wash Area,1.5432817416300497,85281,AZ,TEMPE,4013,33.4493,-111.9251
La Salle-Peru Area Career Ctr,LaSalle Electric Utilities,1.5436805384235555,61354,IL,Peru,17099,41.333247,-89.10748
WILSHIRE PARK ELEMENTARY,MacGillis & Gibbs/Bell Lumber & Pole Co.,1.5439098957677286,55418,MN,SAINT ANTHONY,27053,45.035069,-93.208971
Thoreau,"W.R. Grace & Co., Inc. (Acton Plant)",1.5439478451993043,1742,MA,Concord,25017,42.451728,-71.397424
Everest High School,Parsons Casket Hardware Co.,1.5440460352901648,61008,IL,Belvidere,17007,42.247258,-88.831212
Corwin International Magnet School,Colorado Smelter,1.5443474333823295,81004,CO,PUEBLO,8101,38.2347,-104.6298
Forest Street Community Elementary School,Orange Valley Regional Ground Water Contamination,1.5444760097062213,7050,NJ,ORANGE,34013,40.7668,-74.2492
LOGAN FONTENELLE MIDDLE SCHOOL,PCE - Carriage Cleaners,1.5450443068038195,68005,NE,BELLEVUE,31153,41.154353,-95.91387
CRESTWOOD ELEMENTARY SCHOOL,"Southern Solvents, Inc.",1.545138442759413,33614,FL,TAMPA,12057,28.019183,-82.518208
Catherine E. Doyle Elementary School,Universal Oil Products (Chemical Division),1.5452758525266352,7075,NJ,WOOD  RIDGE,34003,40.8521,-74.0918
PS 298 DR BETTY SHABAZZ,Wolff-Alport Chemical Company,1.545519534801689,11212,NY,BROOKLYN,36047,40.670896,-73.907818
BROWNSVILLE COLLABORATIVE MIDDLE SCHOOL,Wolff-Alport Chemical Company,1.545519534801689,11212,NY,BROOKLYN,36047,40.670896,-73.907818
JOSE NEVAREZ LOPEZ,"Scorpio Recycling, Inc.",1.5455632711498597,951,PR,TOA BAJA,72137,18.402471,-66.253667
Las Plumas High,"Koppers Co., Inc. (Oroville Plant)",1.5458421845986632,95966,CA,Oroville,6007,39.479872,-121.537645
Ponderosa Elementary,"TRW Microwave, Inc. (Building 825)",1.5458881942775142,94086,CA,Sunnyvale,6085,37.3624,-122.0084
Columbus Elementary,"N.W. Mauthe Co., Inc.",1.5459098939300824,54911,WI,Appleton,55087,44.2701,-88.4063
Keith Middle School,New Bedford Site,1.546283841442353,2740,MA,New Bedford,25005,41.646199,-70.949703
Upper Merion Area HS,Henderson Road,1.5463241521417197,19406,PA,King of Prussia,42091,40.097239,-75.381638
Fairwood Elementary,National Semiconductor Corp.,1.5468323429854107,94089,CA,Sunnyvale,6085,37.3964,-121.9901
Zanesville Middle School,Zanesville Well Field,1.5468772623090639,43701,OH,Zanesville,39119,39.9578,-82.0185
Fairwood Elementary,Intel Magnetics,1.5475313550726641,94089,CA,Sunnyvale,6085,37.3964,-121.9901
Wilson Area HS,Industrial Lane,1.5476178840972805,18042,PA,Easton,42095,40.68479,-75.244139
Memorial Elementary School,McLouth Steel Corp,1.547759867226614,48193,MI,RIVERVIEW,26163,42.1791,-83.1878
Patricia M. Noonan School PS #26,PJP Landfill,1.5482553643723638,7306,NJ,Jersey City,34017,40.73909,-74.056391
Marie V. Duffy Elementary School,Picatinny Arsenal (USARMY),1.5484434343097129,7885,NJ,Wharton,34027,40.8951,-74.576
HARRISON CENTRAL ELEMENTARY,"Chemfax, Inc.",1.548588408490198,39503,MS,GULFPORT,28047,30.448885,-89.100954
Adelante High,Riverbank Army Ammunition Plant,1.5486549047130178,95367,CA,Riverbank,6099,37.73728,-120.929668
Academy Park HS,Lower Darby Creek Area,1.5487762166435095,19079,PA,Sharon Hill,42045,39.9078,-75.2679
Old Post Road,Blackburn and Union Privileges,1.5488131210713427,2032,MA,East Walpole,25021,42.145209,-71.22261
Columbus Elementary,San Fernando Valley (Area 2),1.5492811444676666,91203,CA,Glendale,6037,34.153021,-118.261717
SUCCESS ACADEMY CHARTER SCHOOL-WILLIAMSBURG,Newtown Creek,1.549687852429329,11211,NY,BROOKLYN,36047,40.711853,-73.960193
JHS 50 JOHN D WELLS,Newtown Creek,1.549687852429329,11211,NY,BROOKLYN,36047,40.711853,-73.960193
BLONEVA BOND PRIMARY SCHOOL,Hooker (S Area),1.5497297526038931,14303,NY,NIAGARA FALLS,36063,43.088,-79.0311
EXCELSIOR PREP CHARTER SCHOOL OF MIAMI GARDENS,"Anodyne, Inc.",1.5497911658866654,33056,FL,MIAMI GARDENS,12086,25.940388,-80.237652
Central Michigan Correctional Facility,Gratiot County Golf Course,1.5501354388131359,48880,MI,SAINT LOUIS,26057,43.41392,-84.592411
Heritage Elementary,"Chemical Commodities, Inc.",1.5502634504225894,66062,KS,Olathe,20091,38.8596,-94.7896
Alder Creek Middle School,Northwest Pipe & Casing/Hall Process Co,1.5504058821313602,97267,OR,Milwaukie,41005,45.4233,-122.5942
Comm Based Trans Program,"Commencement Bay, Near Shore/Tide Flats",1.550441066227773,98405,WA,Tacoma,53053,47.256133,-122.445663
Special Services,"Commencement Bay, Near Shore/Tide Flats",1.550441066227773,98405,WA,Tacoma,53053,47.256133,-122.445663
Alternative Spcl Needs Div Occ,"Commencement Bay, Near Shore/Tide Flats",1.550441066227773,98405,WA,TACOMA,53053,47.256133,-122.445663
Ann Street School,Diamond Alkali Co.,1.5504511570269908,7105,NJ,NEWARK,34013,40.7232,-74.1561
Furness Horace HS,Welsbach & General Gas Mantle (Camden Radiation),1.5504539069919476,19148,PA,Philadelphia,42101,39.9238,-75.1509
Ellen Ochoa Learning Center,Southern Avenue Industrial Area,1.5506008921815786,90201,CA,Cudahy,6037,33.968483,-118.175636
SUNFIRE HIGH SCHOOL,Wingate Road Municipal Incinerator Dump,1.5507055312470512,33311,FL,OAKLAND PARK,12011,26.16508,-80.174451
SUNFIRE HIGH SCHOOL OF LEE COUNTY,Wingate Road Municipal Incinerator Dump,1.5507055312470512,33311,FL,OAKLAND PARK,12011,26.16508,-80.174451
Keith Valley MS,Raymark,1.5510721148004663,19044,PA,Horsham,42091,40.185938,-75.127009
Lodi MS HS,Maywood Chemical Co.,1.5511087808921138,7644,NJ,LODI,34003,40.875763,-74.080591
HOMER BRINK SCHOOL,"Robintech, Inc./National Pipe Co.",1.5511954283879323,13760,NY,ENDWELL,36007,42.1185,-76.0163
Potomac Elementary,Naval Surface Warfare - Dahlgren,1.5512092281234324,22448,VA,Dahlgren,51099,38.3362,-77.053
KIPP BEYOND CHARTER SCHOOL,Quanta Resources,1.5513989861002602,10027,NY,NEW YORK,36061,40.811171,-73.960777
Woodward Elementary,"Auto Ion Chemicals, Inc.",1.5514744208432538,49007,MI,KALAMAZOO,26077,42.296874,-85.597425
RIVIERA BEACH PREPARATORY & ACHIEVEMENT ACADEMY,"Trans Circuits, Inc.",1.5519176498182696,33404,FL,RIVIERA BEACH,12099,26.780619,-80.092933
Leasure (May B.) Elementary School,Tybouts Corner Landfill,1.5519739634826375,19702,DE,Newark,10003,39.621325,-75.680298
Delcastle Technical High School,"E.I. du Pont de Nemours & Co., Inc. (Newport Pigment Plant Landfill)",1.5524026419546355,19804,DE,Wilmington,10003,39.726107,-75.626918
Bracher Elementary,Monolithic Memories,1.5524151296897852,95051,CA,Santa Clara,6085,37.3668,-121.9755
South Central Michigan Virtual,Michner Plating - Mechanic Street,1.5526287012877305,49202,MI,JACKSON,26075,42.269212,-84.428702
K. Johnson D. Vaughan and M. Jackson STEM Academy,Chemical Control,1.5528159077307846,7202,NJ,Elizabeth,34039,40.657996,-74.215806
Spokane Virtual Academy,General Electric Co. (Spokane Shop),1.5528394394414682,99202,WA,Spokane,53063,47.657121,-117.367789
A. M. Winn Waldorf-Inspired,Mather Air Force Base,1.5529019354883729,95827,CA,Sacramento,6067,38.566011,-121.323654
NORTHSIDE ELEMENTARY SCHOOL,Circuitron Corp.,1.5529200870860607,11735,NY,FARMINGDALE,36059,40.739305,-73.446046
Liberty Creek Elementary School,Greenacres Landfill,1.5529769639232822,99019,WA,Liberty Lake,53063,47.665656,-117.084139
Henry High - SWS,Joslyn Manufacturing & Supply Co.,1.5533433587349779,55412,MN,MINNEAPOLIS,27053,45.0344,-93.305331
Henry High,Joslyn Manufacturing & Supply Co.,1.5533433587349779,55412,MN,MINNEAPOLIS,27053,45.0344,-93.305331
Buffalo Trail Elementary School,Lowry Landfill,1.5534141076844168,80016,CO,AURORA,8005,39.6212,-104.7046
Griffth Jr/Sr High School,"American Chemical Service, Inc.",1.5534553875889008,46319,IN,Griffith,18089,41.5324,-87.4366
Lewis & Clark Middle School,FMC Corp. (Yakima),1.5540020846301938,98902,WA,Yakima,53077,46.5737,-120.5242
Jefferson Elementary,BJAT LLC,1.5541636951651772,2038,MA,Franklin,25021,42.05273,-71.418221
Remington Middle,BJAT LLC,1.5541636951651772,2038,MA,Franklin,25021,42.05273,-71.418221
Goldrick Elementary School,Denver Radium Site,1.5542159988882307,80223,CO,DENVER,8031,39.6976,-105.0153
EARLY COLLEGE CHARTER SCHOOL,LCP Chemicals Inc.,1.5543756174409378,10314,NY,STATEN ISLAND,36085,40.604476,-74.18074
Jose Antonio Vargas Elementary,Teledyne Semiconductor,1.5543931136282458,94043,CA,Mountain View,6085,37.393258,-122.062058
PS 9 SARAH ANDERSON,Quanta Resources,1.5545191630420614,10024,NY,NEW YORK,36061,40.7851,-73.9739
ELROD EL,Bandera Road Ground Water Plume,1.554538009853778,78250,TX,SAN ANTONIO,48029,29.500779,-98.645259
James Simons Montessori,"Koppers Co., Inc. (Charleston Plant)",1.5546650198420793,29403,SC,Charleston,45019,32.800886,-79.94956
Henry W Eggers Middle School,Estech General Chemical Company,1.5548608060563196,46320,IN,Hammond,18089,41.6071,-87.5173
RODERICK R PAIGE EL,North Cavalcade Street,1.5548836230683527,77093,TX,HOUSTON,48201,29.827108,-95.338206
TEEN PARENT PROGRAM - PK,"Trans Circuits, Inc.",1.5550190953258314,33407,FL,RIVIERA BEACH,12099,26.772547,-80.073167
LINCOLN ELEMENTARY SCHOOL,"Trans Circuits, Inc.",1.5550190953258314,33404,FL,RIVIERA BEACH,12099,26.772547,-80.073167
Parke Lane Elementary School,McLouth Steel Corp,1.555119638225257,48138,MI,GROSSE ILE,26163,42.1498,-83.1442
Thomas R Rodman,New Bedford Site,1.555521173825734,2740,MA,New Bedford,25005,41.636331,-70.948711
Edward Hynes Charter School - Parkview,Agriculture Street Landfill,1.555586247695116,70126,LA,New Orleans,22071,30.011085,-90.037332
Brooklyn Center ECSE Age 3 - 5,Kurt Manufacturing Co.,1.5557985539249182,55430,MN,BROOKLYN CENTER,27053,45.063049,-93.30013
Early Childhood Special Education (,Kurt Manufacturing Co.,1.5557985539249182,55430,MN,BROOKLYN CENTER,27053,45.063049,-93.30013
Brooklyn Center Elementary School,Kurt Manufacturing Co.,1.5557985539249182,55430,MN,BROOKLYN CENTER,27053,45.063049,-93.30013
GodfreyLee Early Childhood Ctr,Butterworth #2 Landfill,1.556279325750787,49509,MI,WYOMING,26081,42.930919,-85.690656
Herbert Hoover Middle School,Chemical Insecticide Corp.,1.55630067856184,8837,NJ,EDISON,34023,40.5326,-74.339
Ocean View Elementary,Omega Chemical Corporation,1.5563749396063624,90605,CA,Whittier,6037,33.9597,-118.0178
PARKWAY ELEMENTARY SCHOOL,"Anodyne, Inc.",1.5566074043539917,33169,FL,MIAMI,12086,25.945909,-80.223876
Washington Avenue Elementary School,Price Landfill,1.5570252703746332,8232,NJ,PLEASANTVILLE,34001,39.392932,-74.526097
Collierville Elementary School,Carrier Air Conditioning Co.,1.5571308430202446,38017,TN,Collierville,47157,35.055858,-89.667447
Meadowbrook School,Five Points PCE Plume,1.5574745828243477,84010,UT,BOUNTIFUL,49011,40.896927,-111.888791
CHARLES E RILEY ELEMENTARY SCHOOL,Pollution Abatement Services,1.5577085987226829,13126,NY,OSWEGO,36075,43.4488,-76.4936
Santa Fe Trail Middle School,"Chemical Commodities, Inc.",1.557751922546321,66061,KS,Olathe,20091,38.8993,-94.7959
Audubon Charter Gentilly,Agriculture Street Landfill,1.5580356172451504,70122,LA,New Orleans,22071,30.008284,-90.05306
AZLE HORNET ACADEMY,Sandy Beach Road Ground Water Plume,1.5581063803999284,76020,TX,AZLE,48439,32.911659,-97.542896
PRE K CENTER,Sandy Beach Road Ground Water Plume,1.5581063803999284,76020,TX,AZLE,48439,32.911659,-97.542896
Roberts Elementary School,J & L Landfill,1.5587564009561308,48316,MI,SHELBY TOWNSHIP,26099,42.6776,-83.0898
Oak Hill High,Shaffer Equipment/Arbuckle Creek Area,1.5587864527505564,25901,WV,Oak Hill,54019,37.991247,-81.148202
Barnum Elementary School,Denver Radium Site,1.5589399451339052,80219,CO,DENVER,8031,39.7177,-105.0295
Lonsdale Elementary,"Peterson/Puritan, Inc.",1.5590094511739527,2865,RI,Lincoln,44007,41.908528,-71.416301
Bishop Elementary,Monolithic Memories,1.5591405776586027,94085,CA,Sunnyvale,6085,37.386824,-122.024619
PS 81 THADDEUS STEVENS,Newtown Creek,1.5593742702597586,11221,NY,BROOKLYN,36047,40.693,-73.9349
MS 935,Wolff-Alport Chemical Company,1.559380465773615,11208,NY,BROOKLYN,36047,40.681162,-73.876307
PS 938,Wolff-Alport Chemical Company,1.559380465773615,11208,NY,BROOKLYN,36047,40.681162,-73.876307
ROSWELL HIGH,Lea and West Second Street,1.5596463648337378,88203,NM,ROSWELL,35005,33.37173,-104.527046
Daniel Webster School 46,Reilly Tar & Chemical Corp. (Indianapolis Plant),1.559731555037234,46221,IN,Indianapolis,18097,39.746707,-86.190016
JOHN LEWIS CHILDS SCHOOL,Genzale Plating Co.,1.5598211660260068,11001,NY,FLORAL PARK,36059,40.7267,-73.7035
Walton Farm El Sch,North Penn - Area 6,1.5598340790173173,19446,PA,Lansdale,42091,40.2549,-75.3241
Legion Collegiate Academy,Rock Hill Chemical Co.,1.559906103958218,29730,SC,Rock Hill,45091,34.944112,-81.004026
La Salle-Peru Twp High School,LaSalle Electric Utilities,1.560026967304318,61301,IL,La Salle,17099,41.3325,-89.1053
Southwest  Elem School,Hegeler Zinc,1.5601283285083687,61834,IL,Danville,17183,40.095978,-87.664358
Discovery Woods,Burlington Northern (Brainerd/Baxter Plant),1.5604408949660091,56401,MN,BRAINERD,27035,46.362834,-94.198743
Steele Elementary School,Denver Radium Site,1.5604453820339883,80209,CO,DENVER,8031,39.7102,-104.9717
MILITARY HEIGHTS ELEMENTARY,Lea and West Second Street,1.5610346253193217,88201,NM,ROSWELL,35005,33.416355,-104.533755
Hawthorne Avenue School,White Chemical Corp.,1.5612434839011708,7112,NJ,NEWARK,34013,40.7183,-74.2123
PS 150,Meeker Avenue Plume,1.561490008941238,11104,NY,LONG ISLAND CITY,36081,40.745814,-73.923425
Joshua Eaton,Industri-Plex,1.5617589862636927,1867,MA,Reading,25017,42.514261,-71.111067
Edison High,Fresno Municipal Sanitary Landfill,1.5618970596531356,93706,CA,Fresno,6019,36.719861,-119.8058
Union High School,Butterworth #2 Landfill,1.5629454650280796,49504,MI,GRAND RAPIDS,26081,42.97324,-85.711386
Union High Transition,Butterworth #2 Landfill,1.5629454650280796,49504,MI,GRAND RAPIDS,26081,42.97324,-85.711386
Newcomers Community School,Butterworth #2 Landfill,1.5629454650280796,49504,MI,GRAND RAPIDS,26081,42.97324,-85.711386
Jersey Avenue Elementary,"Waste Disposal, Inc.",1.562951208371577,90670,CA,Santa Fe Springs,6037,33.9534,-118.0821
Alma del Mar Charter School,New Bedford Site,1.5635808929557262,2746,MA,New Bedford,25005,41.665531,-70.923108
Piney Orchard Elementary,Fort George G. Meade,1.5639535357901388,21113,MD,Odenton,24003,39.061055,-76.718972
Brooklyn Center Independent Study,Naval Industrial Reserve Ordnance Plant,1.5641313043111793,55430,MN,BROOKLYN CENTER,27053,45.073767,-93.297704
Brooklyn Center Middle School ALC,Naval Industrial Reserve Ordnance Plant,1.5641313043111793,55430,MN,BROOKLYN CENTER,27053,45.073767,-93.297704
Brooklyn Center High School,Naval Industrial Reserve Ordnance Plant,1.5641313043111793,55430,MN,BROOKLYN CENTER,27053,45.073767,-93.297704
Brooklyn Center Summer School,Naval Industrial Reserve Ordnance Plant,1.5641313043111793,55430,MN,BROOKLYN CENTER,27053,45.073767,-93.297704
Brooklyn Center Middle School,Naval Industrial Reserve Ordnance Plant,1.5641313043111793,55430,MN,BROOKLYN CENTER,27053,45.073767,-93.297704
Brooklyn Center 9 Grade Summer ALC,Naval Industrial Reserve Ordnance Plant,1.5641313043111793,55430,MN,BROOKLYN CENTER,27053,45.073767,-93.297704
Stanton Middle School,"Koppers Co., Inc. (Newport Plant)",1.5645000336521095,19804,DE,Wilmington,10003,39.714239,-75.651011
John W. Wynn Middle,Sutton Brook Disposal Area,1.5646406340854748,1876,MA,Tewksbury,25017,42.601489,-71.213741
ASA Charter,Newmark Ground Water Contamination,1.5647453708114405,92405,CA,San Bernardino,6071,34.155133,-117.294599
CHARLES CAMPAGNE SCHOOL,Hooker Chemical & Plastics Corp./Ruco Polymer Corp.,1.5647930392755103,11714,NY,BETHPAGE,36059,40.758,-73.4741
Helen I. Smith School,"Curcio Scrap Metal, Inc.",1.5648120783508166,7663,NJ,SADDLE BROOK,34003,40.9125,-74.0961
Monte Sano Elementary School,Alternate Energy Resources,1.5648548914398737,30904,GA,Augusta,13245,33.468324,-82.015686
Eastern High School,"Motor Wheel, Inc.",1.5648923770773275,48912,MI,LANSING,26065,42.739616,-84.524561
Pearl Stephens Elementary School,Robins Air Force Base (Landfill #4/Sludge Lagoon),1.5651874237152412,31098,GA,Warner Robins,13153,32.610973,-83.606826
Stevenson Elementary,Intel Corp. (Mountain View Plant),1.565206764105606,94043,CA,Mountain View,6085,37.403389,-122.083817
Clackamas Middle College,Northwest Pipe & Casing/Hall Process Co,1.5654567780219508,97086,OR,Happy Valley,41005,45.43614,-122.579538
Pacific Drive Elementary,Orange County North Basin,1.565583012647818,92833,CA,Fullerton,6059,33.8671,-117.9536
Clovis Grove Elementary,Schmalz Dump,1.5656931844390747,54952,WI,Menasha,55139,44.21606,-88.42714
Central Middle School,Garden City Ground Water Plume,1.565836138195096,47201,IN,Columbus,18005,39.205309,-85.915221
LaSalle Co Detention Center 6-8,Ottawa Radiation Areas,1.5658541743128913,61350,IL,Ottawa,17099,41.372839,-88.825793
LaSalle Co Detention Center 9-12,Ottawa Radiation Areas,1.5658541743128913,61350,IL,Ottawa,17099,41.372839,-88.825793
Mary Daly Elementary School,Conrail Rail Yard (Elkhart),1.5659545914951363,46514,IN,Elkhart,18039,41.6848,-86.002
John F Kennedy Elem School,Packaging Corp. of America,1.5664038457228269,49660,MI,MANISTEE,26101,44.2182,-86.302831
Roosevelt Elementary,Southern Avenue Industrial Area,1.566450710499624,90262,CA,Lynwood,6037,33.9346,-118.2005
School #4,Quanta Resources,1.5664769442893984,7010,NJ,CLIFFSIDE PARK,34003,40.8267,-73.9861
Da Vinci Schools K5,Michner Plating - Mechanic Street,1.5667380352259503,49202,MI,JACKSON,26075,42.275068,-84.416029
Mission Early College High,"Advanced Micro Devices, Inc.",1.566764837384494,95054,CA,Santa Clara,6085,37.391286,-121.982133
Stony Brook El Sch,East Mount Zion,1.56691697918735,17402,PA,York,42133,39.995,-76.6405
Endeavor Elementary,Kentwood Landfill,1.567280239270285,49512,MI,GRAND RAPIDS,26081,42.8588,-85.5674
Cardozo Middle,Riverbank Army Ammunition Plant,1.5674582026801955,95367,CA,Riverbank,6099,37.736837,-120.931631
Mad River Early Childhood Center,North Sanitary Landfill,1.5677119030275004,45431,OH,Dayton,39113,39.777022,-84.125305
Wheeless Road Elementary School,Peach Orchard Road PCE Ground Water Plume,1.5678368961936653,30906,GA,Augusta,13245,33.428946,-82.04079
Virtual Heights Elementary,Kurt Manufacturing Co.,1.5680791598383104,55421,MN,COLUMBIA HEIGHTS,27003,45.055373,-93.238941
Virtual Heights Secondary,Kurt Manufacturing Co.,1.5680791598383104,55421,MN,COLUMBIA HEIGHTS,27003,45.055373,-93.238941
EARLY CHILDHOOD,Kurt Manufacturing Co.,1.5680791598383104,55421,MN,COLUMBIA HEIGHTS,27003,45.055373,-93.238941
IPREP  ACADEMY NORTH,Petroleum Products Corp.,1.5681772643521883,33179,FL,MIAMI,12086,25.969974,-80.174019
North Elem School,Yeoman Creek Landfill,1.5681972042627494,60085,IL,Waukegan,17097,42.368765,-87.83464
Belleville PS4,Riverside Industrial Park,1.5684646136159972,7109,NJ,BELLEVILLE,34013,40.781879,-74.180108
Jaime Escalante Elementary,Cooper Drum Company,1.5685444354018376,90201,CA,Cudahy,6037,33.968366,-118.188522
CENTENNIAL ELEMENTARY SCHOOL,10th Street Site,1.5685538554547693,68602,NE,COLUMBUS,31141,41.418452,-97.333821
NORTHEAST SCHOOL,Preferred Plating Corp.,1.568816644476276,11701,NY,AMITYVILLE,36103,40.695734,-73.411569
MS 243 CENTER SCHOOL,Quanta Resources,1.5689202763898327,10024,NY,NEW YORK,36061,40.784925,-73.973752
Kings Highway El Sch,Blosenski Landfill,1.5690114108601394,19320,PA,Coatesville,42029,40.0123,-75.8825
Early Childhood Special Education S,Naval Industrial Reserve Ordnance Plant,1.5691497619681685,55432,MN,FRIDLEY,27003,45.078186,-93.256901
Voluntary Prekindergarten School,Naval Industrial Reserve Ordnance Plant,1.5691497619681685,55432,MN,FRIDLEY,27003,45.078186,-93.256901
OMAHA PUBLIC SCHOOLS HOMEBASED,Omaha Lead,1.5691886722335888,68131,NE,OMAHA,31055,41.267518,-95.960099
OPS VIRTUAL HIGH SCHOOL,Omaha Lead,1.5691886722335888,68131,NE,OMAHA,31055,41.267518,-95.960099
OPS VIRTUAL ELEMENTARY SCHOOL,Omaha Lead,1.5691886722335888,68131,NE,OMAHA,31055,41.267518,-95.960099
OPS VIRTUAL MIDDLE SCHOOL,Omaha Lead,1.5691886722335888,68131,NE,OMAHA,31055,41.267518,-95.960099
St Louis Correctional Facility,Gratiot County Golf Course,1.5692212865369999,48880,MI,SAINT LOUIS,26057,43.412273,-84.592308
Penn High School,Galen Myers Dump/Drum Salvage,1.5692790976610702,46545,IN,Mishawaka,18141,41.6791,-86.108
Eastgate School,East Helena Site,1.5694088241923678,59635,MT,East Helena,30049,46.595967,-111.892716
Madison Park Elementary School,CPS/Madison Industries,1.5696357196357607,8859,NJ,PARLIN,34023,40.4518,-74.3086
Delaware Military Academy,"E.I. du Pont de Nemours & Co., Inc. (Newport Pigment Plant Landfill)",1.5696731805300517,19804,DE,Wilmington,10003,39.721594,-75.585126
Mariano Castro Elementary,"CTS Printex, Inc.",1.5700761346314995,94040,CA,Mountain View,6085,37.394436,-122.093134
OLSON MIDDLE,Joslyn Manufacturing & Supply Co.,1.5701786903724788,55430,MN,MINNEAPOLIS,27053,45.046651,-93.301311
Renaissance Community Innovation School,Atlas Tack Corp.,1.5703735861180061,2740,MA,New Bedford,25005,41.626103,-70.9222
Alfred J Gomes,Atlas Tack Corp.,1.5703735861180061,2740,MA,New Bedford,25005,41.626103,-70.9222
TARPON SPRINGS HIGH SCHOOL,Stauffer Chemical Co. (Tarpon Springs),1.5704010395545678,34689,FL,TARPON SPRINGS,12103,28.144007,-82.779231
McKinley Elementary School,Des Moines TCE,1.5705292335946899,50315,IA,Des Moines,19153,41.573586,-93.606078
BROOKLYN SCHOOL FOR MUSIC & THEATER,Gowanus Canal,1.5705669087563816,11225,NY,BROOKLYN,36047,40.67,-73.9615
BROOKLYN ACADEMY OF SCIENCE AND THE ENVIRONMENT,Gowanus Canal,1.5705669087563816,11225,NY,BROOKLYN,36047,40.67,-73.9615
INTERNATIONAL HIGH SCHOOL AT PROSPECT HEIGHTS,Gowanus Canal,1.5705669087563816,11225,NY,BROOKLYN,36047,40.67,-73.9615
HIGH SCHOOL FOR GLOBAL CITIZENSHIP (THE),Gowanus Canal,1.5705669087563816,11225,NY,BROOKLYN,36047,40.67,-73.9615
John H. Winslow Elementary School,Former Kil-Tone Company,1.570609210622291,8360,NJ,VINELAND,34011,39.4638,-75.0029
SUNSHINE ELEMENTARY CHARTER SCHOOL,Petroleum Products Corp.,1.570673260363383,33020,FL,HOLLYWOOD,12011,26.014982,-80.163734
PARAGON ACADEMY OF TECHNOLOGY,Petroleum Products Corp.,1.570673260363383,33020,FL,HOLLYWOOD,12011,26.014982,-80.163734
GLEN COVE HIGH SCHOOL,"Mattiace Petrochemical Co., Inc.",1.5707126823792028,11542,NY,GLEN COVE,36059,40.879972,-73.627239
ALAMEDA ELEMENTARY,Griggs & Walnut Ground Water Plume,1.5707254232659411,88005,NM,LAS CRUCES,35013,32.320765,-106.786265
Catherine E. Doyle Elementary School,Garfield Ground Water Contamination,1.57098057450494,7075,NJ,WOOD  RIDGE,34003,40.8521,-74.0918
BRIGHTER CHOICE COMMUNITY SCHOOL,Newtown Creek,1.5712534906721964,11206,NY,BROOKLYN,36047,40.6939,-73.9408
Orchard Knob Middle School,Southside Chattanooga Lead,1.5712696499881238,37404,TN,Chattanooga,47065,35.044361,-85.276728
Longfellow New Tech Elementary Sch,"American Chemical Service, Inc.",1.5713958417256622,46408,IN,Gary,18089,41.5356,-87.4093
Millcreek Jr High,Bountiful/Woods Cross 5th South PCE Plume,1.5716930904404436,84010,UT,BOUNTIFUL,49011,40.879804,-111.875305
Eastside Elementary School,"Combustion, Inc.",1.5721036102645845,70726,LA,Denham Springs,22063,30.49966,-90.91539
Dennis B O'Brien Elementary School,Rockaway Borough Well Field,1.572379918923967,7801,NJ,DOVER,34027,40.9097,-74.5454
Frank W. Gavlak Elementary School,Ventron/Velsicol,1.5724159849243975,7057,NJ,WALLINGTON,34003,40.8532,-74.104
Will Rogers Elementary,Southern Avenue Industrial Area,1.572505915611232,90262,CA,Lynwood,6037,33.924,-118.1825
Pettit Park School,Continental Steel Corp.,1.5725913908058589,46901,IN,Kokomo,18067,40.493879,-86.14158
